"id","index","type","score","date","speaker","party","function","role","paragraphs_count","house","highlight text"
"nl.proc.ob.d.h-tk-20112012-19-7.1.11.1","nl.proc","speech",0.9375743,"2011-11-03","Dijksma","PvdA","Mevrouw","mp",12,"commons"," belangenorganisaties een mogelijkheid om schade <em>collectief</em> te verhalen ontbreekt als gevolg van de expliciete uitsluiting in het BW 3:305a, lid 3, als de schadeveroorzakende partij niet bereid is tot een schikking te komen; overwegende dat een instrument voor <em>collectieve</em> schadevergoeding efficiëntievoordelen biedt voor alle betrokken partijen en dat dit de"
"nl.proc.ob.d.h-tk-20092010-21-1755.1.17.3","nl.proc","speech",0.92104423,"2009-11-05","Azough","GroenLinks","Mevrouw","mp",9,"commons","Voorzitter. De volgende motie die ik wil indienen kan actueel genoemd worden. De Kamer, gehoord de beraadslaging, overwegende dat het ondanks het bestaan van de Wet <em>collectieve</em> afhandeling massaschade thans ontbreekt aan <em>collectieve</em> schadevergoedingsmogelijkheden voor grote groepen consumenten die slachtoffer zijn geworden van dezelfde"
"nl.proc.ob.d.h-tk-20092010-99-8020.1.5.9","nl.proc","speech",0.8114057,"2010-09-14","Van Bommel","SP","De heer","mp",2,"commons","Terwijl er in Frankrijk <em>collectief</em> Roma op grond van hun gemeenschappelijke etniciteit worden uitgezet, dreigt er in Nederland een regering gevormd te worden met de PVV, die tientallen miljoenen moslims op grond van hun <em>collectieve</em> identiteit wil uitzetten uit Europa. Dit betoogde haar leider Wilders vorig jaar nog in Denemarken. Dat toont nog"
"nl.proc.ob.d.h-tk-20112012-32-25.1.4.1","nl.proc","speech",0.7083695,"2011-12-06","Jacobi","PvdA","Mevrouw","mp",12,"commons"," natuur- en landschapsbeheer; overwegende dat samenwerking de kwaliteit bevordert, zoals aangetoond in de Noardlike Fryske Wâlden; overwegende dat het mogelijk moet worden <em>collectieve</em> aanvragen te doen; verzoekt de regering, tot een regeling te komen waarbij meerdere kleinere aanvragen worden gebundeld en <em>collectief</em> worden behandeld, en gaat over tot de orde van de dag. Deze motie is voorgesteld door het lid Jacobi. Naar mij blijkt, wordt de indiening ervan voldoende ondersteund. Zij krijgt nr. 25 (29246) ."
"nl.proc.ob.d.h-tk-20132014-9-15.1.12.2","nl.proc","speech",0.7083695,"2013-10-03","Van Gerven","SP","De heer","mp",2,"commons"," stilstaan bij het feit dat de minister zegt dat we ten opzichte van het buitenland relatief weinig eigen betalingen hebben. We hebben echter wel hoge premies. Gelet op het beleid dat er nu ligt, moeten we toch constateren dat er een verschuiving heeft plaatsgevonden van <em>collectieve</em> financiering naar private financiering? Het gaat hierbij om een"
"nl.proc.ob.d.h-tk-20142015-6-9.1.14.1","nl.proc","speech",0.6629652,"2014-09-25","Van Klaveren","Groep Bontes/Van Klaveren","De heer","mp",21,"commons"," beraadslaging,  constaterende dat het draagvlak voor het verplichte en <em>collectieve</em> aanvullende pensioen afneemt;  overwegende dat individuen niet gedwongen dienen te worden om een deel van hun salaris in een <em>collectief</em> fonds te storten voor aanvullend pensioen;  verzoekt de regering, in te zetten op beëindiging van het verplichte, <em>collectieve</em> aanvullende"
"nl.proc.ob.d.h-tk-20152016-9-11.1.16.1","nl.proc","speech",0.6629652,"2015-10-01","Van Klaveren","Groep Bontes/Van Klaveren","De heer","mp",10,"commons",",  constaterende dat het draagvlak voor het verplichte en <em>collectieve</em> aanvullende pensioen afneemt;  overwegende dat individuen niet gedwongen dienen te worden om een deel van hun salaris in een <em>collectief</em> fonds te storten voor een aanvullend pensioen;  verzoekt de regering, in te zetten op beëindiging van het verplichte, <em>collectieve</em> aanvullende pensioen"
"nl.proc.ob.d.h-tk-20052006-6307-6341.1.11.5","nl.proc","speech",0.644731,"2006-09-06","Huizinga-Heringa","ChristenUnie","Mevrouw","mp",2,"commons","De crux zit in het woord <em>collectief</em>. U bent wel voor een rustdag, maar dan mag iedereen zelf uitmaken wanneer hij die rustdag neemt. U vraagt waarom de wetgever of de overheid een bepaalde dag zou moeten aanwijzen als rustdag. Ik ben een groot voorstander van een <em>collectieve</em> rustdag, omdat die de hele samenleving ten goede komt. Neem het voorbeeld"
"nl.proc.ob.d.h-tk-20052006-5874-5876.1.4.1","nl.proc","speech",0.644731,"2006-06-27","Dittrich","D66","De heer","mp",12,"commons"," culturele diversiteit. Ik heb in dat overleg aangekondigd dat ik dat graag wil vastleggen in een motie, mede namens een aantal collega's. De DittrichKamer, gehoord de beraadslaging, overwegende dat het <em>collectieve</em> beheer van muziekauteursrechten belangrijk is voor de inkomensvorming van componisten, tekstschrijvers en muziekuitgevers; overwegende dat in"
"nl.proc.ob.d.h-tk-20102011-14-2.1.7.58","nl.proc","speech",0.644731,"2010-10-27","Roemer","SP","De heer","mp",2,"commons"," de <em>collectieve</em> zekerheid, waarin wij een heleboel dingen als beschaving <em>collectief</em> regelen. Het feit dat wij een sociaal vangnet hebben en dat wij staan voor mensen die uit de boot dreigen te vallen. Wij moeten ook garant staan voor de leefbaarheid van wijken en voor allerlei voorzieningen waarvan wij vinden dat ze van ons allemaal zijn. De heer"
"nl.proc.ob.d.h-tk-20122013-61-9.1.7.1","nl.proc","speech",0.60615206,"2013-03-13","Mei Li Vos","PvdA","Mevrouw","mp",7,"commons",". Dit heeft te maken met die andere manier om <em>collectief</em> je schade te verhalen, het <em>collectief</em> actierecht zoals dat staat in het Burgerlijk Wetboek 3:305a, waar ook de motie-Dijksma c.s. over gaat. Daar staat een bepaling dat het verhalen in geld niet mogelijk is. Daar gaat de motie over, met de vraag of dat niet toch kan, omdat dat inderdaad – mijn"
"nl.proc.ob.d.h-tk-20112012-105-37.1.7.1","nl.proc","speech",0.5666956,"2012-07-05","Schouw","D66","De heer","mp",12,"commons","Voorzitter. Ook ik heb een motie over 1F. Motie De Kamer, gehoord de beraadslaging, overwegende dat het Nederlandse 1F-beleid tekortschiet ten aanzien van Afghaanse vluchtelingen die als onderofficier of officier bij de Khad/Wad hebben gediend doordat zij op grond van een ambtsbericht uit 2000 <em>collectief</em> worden beschuldigd van"
"nl.proc.ob.d.h-tk-20132014-35-8.1.10.35","nl.proc","speech",0.5666956,"2013-12-11","Klaver","GroenLinks","De heer","mp",2,"commons"," overheid daar niet aan zou moeten bijdragen. In onze voorstellen en zelfs in die van het kabinet wordt nog meer dan 80% van de kosten voor het hoger onderwijs uit <em>collectieve</em> middelen betaald. Dat is ook terecht. Wat mij betreft zou dat nog meer kunnen zijn, want onderwijs is niet alleen van belang voor individuen maar ook voor de samenleving als"
"nl.proc.ob.d.h-tk-20142015-29-3.1.9.19","nl.proc","speech",0.5288693,"2014-11-26","Vermeij","PvdA","Mevrouw","mp",2,"commons"," <em>collectief</em>, verplicht en solidair pensioen. Dat er nog vraagstukken moeten worden opgelost, weten wij ook, want de vele baanwisselingen en de oneerlijke doorsneepremie zijn absoluut een feit. Maar risico's met elkaar delen, van jongs af aan en waar je ook werkt, en met een goede werkgeversbijdrage pensioen opzij zetten voor later, is gewoon een goed"
"nl.proc.ob.d.h-tk-20142015-52-24.1.7.1","nl.proc","speech",0.5055481,"2015-02-10","Verhoeven","D66","De heer","mp",16,"commons"," krijg hierop graag een reactie. Is de staatssecretaris bereid om hier in de toekomst over na te denken?  Ik wil nog even ingaan op de praktijk van de <em>collectieve</em> beheersorganisaties. Het is helder dat D66 een voorstander is van het idee van <em>collectief</em> beheer — los van de online beperkingen — omdat de transactiekosten daarmee worden verlaagd en er"
"nl.proc.ob.d.h-tk-20052006-5179-5197.1.7.7","nl.proc","speech",0.4994443,"2006-06-01","Örgü","VVD","Mevrouw","mp",4,"commons"," definitie van \"<em>collectieve</em> consumentenbelangen\". Het is de VVD-fractie onhelder wat zij daar precies onder moet verstaan. Het mag niet zo zijn dat een belang <em>collectief</em> is als slechts twee mensen dezelfde klacht hebben. De invulling van het begrip \"<em>collectieve</em> consumentenbelangen\" is voor de reikwijdte van deze wet van groot belang en dient"
"nl.proc.ob.d.h-tk-20062007-407-418.1.11.3","nl.proc","speech",0.49862272,"2006-10-03","Vendrik","GroenLinks","De heer","mp",5,"commons"," melden. Of de postbussen van de heer Omtzigt moeten dichtgeplakt zijn om de jeugd een niet al te frivool oudjaar te bezorgen. Een ander punt betreft de <em>collectieve</em> contracten. Ik heb meldingen van mensen die via een <em>collectief</em> contract aangesloten zijn bij een verzekeraar, soms via de werkgever en soms anderszins. Op een site van volgens mij KPMG wordt"
"nl.proc.ob.d.h-tk-20102011-17-2.1.10.19","nl.proc","speech",0.49585867,"2010-11-03","Samsom","PvdA","De heer","mp",2,"commons","De eerste vraag heb ik feitelijk al een beetje beantwoord. Ik ga overigens niet schoorvoetend akkoord, ik ga mopperend akkoord. Laat we het zo maar ongeveer stellen. Hoe dan ook, ik ga wel akkoord en dat is uiteindelijk belangrijk in dit huis. Ik ben zo voor die collectiviteit in dezen, omdat er ook een <em>collectief</em> belang achter zit. Ja, u hebt"
"nl.proc.ob.d.h-tk-20142015-73-7.1.5.3","nl.proc","speech",0.49585867,"2015-04-08","Schouw","D66","De heer","mp",13,"commons"," gediend, doordat zij op grond van een ambtsbericht uit 2000 <em>collectief</em> worden beschuldigd van mensenrechtenschendingen en hun schuld dan wel onschuld niet per individu is vastgesteld;  van mening dat een <em>collectieve</em> 1F-tegenwerping en omgekeerde bewijslast zonder rechterlijke toetsing geen recht doet aan het individuele relaas van deze groep"
"nl.proc.ob.d.h-tk-20142015-27-9.1.20.1","nl.proc","speech",0.49585867,"2014-11-20","Van Klaveren","Groep Bontes/Van Klaveren","De heer","mp",12,"commons","Voorzitter. Ik dank de bewindspersonen voor de beantwoording. Het trieste resultaat van 40 jaar sociaaldemocratische indoctrinatie: zelfs de VVD-woordvoerder stelt pal te staan voor meer solidariteit in het <em>collectieve</em> zorgsysteem. Het was alsof ik mevrouw Leijten van de SP hoorde spreken. We hebben al eens gewezen op de uitspraak van Milton"
"nl.proc.ob.d.h-tk-20122013-61-9.1.5.1","nl.proc","speech",0.49442464,"2013-03-13","De Wit","SP","De heer","mp",7,"commons"," oprichten. Maar is dat niet omslachtig? Schade bij een pensioenfonds komt toch per definitie voor rekening van het <em>collectief</em> van gepensioneerden en pensioendeelnemers? Waarom blijft die toegang beperkt? Wat is er op tegen om dit mogelijk te maken? Ten slotte kom ik bij de rechtsbijstand. Gedupeerden die een <em>collectieve</em> actie tegen schadeveroorzakers"
"nl.proc.ob.d.h-tk-20112012-53-29.1.6.1","nl.proc","speech",0.4566717,"2012-02-14","Smeets","PvdA","Mevrouw","mp",12,"commons"," aantreden van het nieuwe kabinet. Maar goed, eindelijk is het dan zover. De PvdA-fractie vindt het van groot belang dat het goed functioneren van het <em>collectief</em> beheren van auteursrechten en naburige rechten wordt bevorderd. Het wetsvoorstel dat we vandaag behandelen, is daarom ook zo belangrijk. Het wettelijke toezicht op de <em>collectieve</em>"
"nl.proc.ob.d.h-tk-20102011-19-29.1.9.52","nl.proc","speech",0.44072437,"2010-11-09","Venrooy-van Ark","VVD","Mevrouw","mp",5,"commons",". Waarom doen wij dit, waarom willen wij dit bespreekbaar maken? De VVD wil op deze manier het persoonsgebonden budget voor levensbrede en levenslange zorg borgen en verankeren. Tevens willen wij bewerkstelligen dat de <em>collectief</em> aangeboden zorg in natura altijd voorhanden is en dat de keuze voor een pgb dus een vrije keuze is. De AWBZ is niet de enige"
"nl.proc.ob.d.h-tk-20112012-90-8.1.3.1","nl.proc","speech",0.44072437,"2012-05-31","Gerbrands","PVV","Mevrouw","mp",6,"commons"," er is op <em>collectieve</em> wijze gefaald. De uitbraak had voorkomen kunnen worden en dit is de betrokkenen aan te rekenen. Dit is echt heel, heel ernstig. Patiënten zijn onnodig aan risico's blootgesteld en als gevolg daarvan zijn er in ieder geval drie patiënten overleden en mogelijk nog tien meer. Terecht is de inspectie daarom gestart met een tuchtzaak"
"nl.proc.ob.d.h-tk-20072008-5422-5448.1.10.1","nl.proc","speech",0.4250217,"2008-04-16","Ulenbelt","SP","De heer","mp",3,"commons"," opnemen. Er is een veel belangrijker argument voor deze wet. Zwangerschap brengt de vrouwelijke zelfstandige in een financieel nadelige positie ten opzichte van niet-zwangeren en mannen. Terecht wordt nu een <em>collectieve</em> regeling voor zwangerschaps- en bevallingsverlof voor zelfstandigen ingevoerd. Het financiële nadeel dat zelfstandige vrouwen"
"nl.proc.ob.d.h-tk-20102011-77-5.1.10.40","nl.proc","speech",0.4250217,"2011-04-21","Dijkgraaf","SGP","De heer","mp",6,"commons"," duidelijke en principiële lijn van mijn fractie. De zondag is een <em>collectief</em> gewaardeerde rustdag. Door tal van mensen wordt die <em>collectieve</em> waarde op verschillende manieren ingevuld. De SGP-fractie blijft van mening dat de zondag als de gedenkdag van de opstanding uit de dood van Jezus Christus ook anno Domini 2011 grote waarde heeft. Juist daar staan"
"nl.proc.ob.d.h-tk-20092010-62-5513.1.4.1","nl.proc","speech",0.41435325,"2010-03-11","Karabulut","SP","Mevrouw","mp",5,"commons"," werk uitvoeren en meedoen, worden getreiterd en geïntimideerd. Eerder kregen wij signalen dat NS stakingsbrekers inzet om deze belangrijke <em>collectieve</em> actie van de schoonmakers te breken. Gisteren is het dieptepunt bereikt. NS roept in een brief eigen personeel op om besmet werk te doen. Schiphol weigert een vakbondsvrouw de toegang tot de kantine"
"nl.proc.ob.d.h-tk-20102011-80-5.1.5.3","nl.proc","speech",0.41435325,"2011-04-28","Van Bommel","SP","De heer","mp",7,"commons",". Naar het oordeel van de SP is de blokkade van Gaza illegaal. Deze blokkade moet worden opgevat als een <em>collectieve</em> bestraffing van de hele bevolking in Gaza voor terroristische activiteiten van een kleine groep fundamentalisten. Artikel 33 van de Conventie van Genève verbiedt <em>collectief</em> straffen. Ook Nederland is partij bij de Conventie van Genève"
"nl.proc.ob.d.h-tk-20122013-61-9.1.8.1","nl.proc","speech",0.40570286,"2013-03-13","Van Oosten","VVD","De heer","mp",6,"commons","Dank u wel. Voorzitter. We spreken vanavond met name over de technische wijziging die voorligt van de Wet <em>collectieve</em> afwikkeling massaschade. Ik zal daar kort nader bij stilstaan en heb daarbij een twee- of drietal vragen voor de minister. Voordat ik dat doe, voel ik de behoefte om een enkele opmerking te maken over het"
"nl.proc.ob.d.h-tk-20052006-5179-5197.1.5.5","nl.proc","speech",0.37216505,"2006-06-01","Crone","PvdA","De heer","mp",13,"commons"," een <em>collectief</em> consumentenbelang ligt in de geest van deze wet, wordt het geval dan doorgemeld of wordt de consument doorverwezen naar het <em>collectieve</em> loket van de Consumentenautoriteit? In dat geval ontstaat een mooi dekkend systeem. Individuele klachten op regionaal niveau komen terecht bij Wegwijzer in het recht. Daarbovenop komt de meer"
"nl.proc.ob.d.h-tk-20122013-39-10.1.8.1","nl.proc","speech",0.3684177,"2013-01-15","Paulus Jansen","SP","De heer","mp",9,"commons","% compensatie van de verminderde opbrengst van de verhuurdersheffing. Ook voor de koopsector moet er snel iets gebeuren. Komt dat Nationaal Fonds Energiebesparing er nu wel of niet? De SP pleit ervoor om een <em>collectieve</em> aanpak van de koopsector een streepje voor te geven bij financiële prikkels. Je zou kunnen afspreken dat bij een beperkt budget projecten"
"nl.proc.ob.d.h-tk-20052006-6307-6341.1.11.19","nl.proc","speech",0.35418475,"2006-09-06","Huizinga-Heringa","ChristenUnie","Mevrouw","mp",6,"commons","Ik heb net al tegen de minister gezegd dat het uitgangspunt weliswaar goed is, maar de uitwerking er niet naar is. U zegt dat uitgangspunt is dat arbeid zo wordt georganiseerd dat geen zondagsarbeid nodig is, maar dat <em>collectief</em> wel kan worden afgesproken om elke zondag van het jaar te gaan werken. Dat is volgens ons in tegenspraak met elkaar. De"
"nl.proc.ob.d.h-tk-20052006-5179-5197.1.7.1","nl.proc","speech",0.35418475,"2006-06-01","Örgü","VVD","Mevrouw","mp",5,"commons"," taak en omvang niet worden overschreden. De Consumentenautoriteit mag pas ingrijpen bij inbreuken op het consumentenrecht met een <em>collectief</em> karakter indien de markt niet voldoende in staat blijkt om door middel van zelfregulering of civielrechtelijke procedures schadelijke praktijken te stoppen. Dat is een goed uitgangspunt. Wij hechten eraan dat"
"nl.proc.ob.d.h-tk-20112012-21-7.1.7.57","nl.proc","speech",0.35418475,"2011-11-09","Mulder","VVD","De heer","mp",9,"commons"," aanslag op de <em>collectieve</em> middelen leidt, middelen die andere burgers moeten opbrengen. Daarnaast hebben veel mensen het idee dat zorg een gratis recht is waar bijna geen plicht meer tegenover staat, want: \"Ik heb mijn zorgpremie toch betaald?\". De premies zijn echter <em>collectief</em> opgebracht. Deze onwetendheid wordt verder versterkt door medicalisering"
"nl.proc.ob.d.h-tk-20072008-997-1018.1.15.1","nl.proc","speech",0.35418475,"2007-10-18","Van Raak","SP","De heer","mp",6,"commons"," terughoudend te zullen zijn. De staatssecretaris zegt ook dat zij veel waarde hecht aan ruimte voor een eigen afweging in de lokale democratie. Op onze bezwaren heeft zij niet een goed antwoord gegeven. De ozb is nauwelijks van invloed op de <em>collectieve</em> lasten. In het voorstel blijft het zo dat alle gemeenten worden gestraft als individuele gemeenten"
"nl.proc.ob.d.h-tk-20142015-65-3.1.10.1","nl.proc","speech",0.35418475,"2015-03-19","Öztürk","Groep Kuzu/Öztürk","De heer","mp",6,"commons"," banken in Nederland verantwoordelijk zijn voor een goede mkb-financiering, dat dit een kerntaak is en dat zij dit niet weg kunnen bezuinigen? Is de minister bereid om banken te dwingen om deze maatschappelijke verantwoordelijkheid te nemen? Is het mogelijk hen <em>collectief</em> targets op te leggen, bijvoorbeeld dat het afwijzingspercentage maximaal 5 mag zijn"
"nl.proc.ob.d.h-tk-20112012-61-9.1.7.1","nl.proc","speech",0.3525795,"2012-03-08","Peters","GroenLinks","Mevrouw","mp",19,"commons"," beschermd werk een billijke vergoeding dient te worden betaald; constaterende dat <em>collectief</em> beheer van beschermde werken voor de inkomenspositie van veel makers en het gebruiksgemak van veel gebruikers onmisbaar is, maar dat dit onder druk staat door een gebrek aan transparantie, maatwerk en gelegenheid tot inspraak bij de tarifering en daardoor"
"nl.proc.ob.d.h-tk-20132014-42-10.1.6.30","nl.proc","speech",0.34862298,"2014-01-16","Agema","PVV","Mevrouw","mp",2,"commons","Dat is zeker positief! Zou daarbij de mogelijkheid meegenomen kunnen worden dat het <em>collectieve</em> falen op het conto van een individuele BIG-geregistreerde wordt geschreven?"
"nl.proc.ob.d.h-tk-20132014-73-3.1.11.20","nl.proc","speech",0.34037822,"2014-04-09","Segers","ChristenUnie","De heer","mp",11,"commons"," godsdienst op in een <em>collectief</em> aspect en een individueel aspect en geven daarbij het individuele aspect voorrang. Dit is echter juridisch geen gangbare argumentatielijn. Waarom beschouwen de indieners een <em>collectieve</em> religiebeleving niet evenzeer als een uiting van individuele keuzevrijheid? Het gaat om de individuele vrijheid om een gemeenschap te vormen"
"nl.proc.ob.d.h-tk-20072008-3146-3159.1.12.11","nl.proc","speech",0.3314826,"2008-01-15","Van Gent","GroenLinks","Mevrouw","mp",6,"commons"," woning en alles rondom de woning, zeg maar: de <em>collectieve</em> voorzieningen. Het gaat ons namelijk enerzijds om het individu dat wat ons betreft aan de corporatie om een aantal verbeteringen moet kunnen vragen en daarvoor eventueel ook wat meer huur betaalt en anderzijds om <em>collectieve</em> afspraken of wensen. Verder gaat het ons om het recht op"
"nl.proc.ob.d.h-tk-20052006-6307-6341.1.7.40","nl.proc","speech",0.2954648,"2006-09-06","Rambocus","CDA","Mevrouw","mp",3,"commons","Ik zal nog eens kijken naar het woord <em>collectief</em>, maar herhaal wat ik heb gezegd. De minister heeft aangegeven dat <em>collectief</em> kan worden afgeweken van de regeling. Wij gaan ervan uit dat de zondag in beginsel een vrije rustdag moet blijven, maar ik wil er wel met de heer Van der Sande naar kijken. Ik heb het al gehad over de aard van de arbeid, de"
"nl.proc.ob.d.h-tk-20062007-1912-1930.1.9.8","nl.proc","speech",0.2954648,"2006-12-20","Depla","PvdA","De heer","mp",10,"commons","Dan het punt van het particulier opdrachtgeverschap. De minister is van mening dat het niet nodig is om de stimuleringsregeling die er nu is voor het stedelijk gebied open te stellen voor het landelijk gebied. Wij zijn dat wel van mening en daarom deze motie. De Kamer, gehoord de beraadslaging, overwegende dat (<em>collectief</em>) particulier"
"nl.proc.ob.d.h-tk-20122013-13-16.1.11.18","nl.proc","speech",0.2954648,"2012-10-23","Heerma","CDA","De heer","mp",2,"commons"," aangeven of die wel of niet klopt. Mijn volgende vraag is of het voor kleinere bedrijven, waar dus ook specifiek het signaal vandaan komt, niet veel moeilijker is om dat ondernemersrisico op te vangen dan voor grotere bedrijven. Als binnen wat de staatssecretaris het <em>collectief</em> noemt en wat ik de sector noem – het is namelijk niet het gehele"
"nl.proc.ob.d.h-tk-20062007-79-100.1.14.3","nl.proc","speech",0.292992,"2006-09-21","Vendrik","GroenLinks","De heer","mp",14,"commons"," Pensioenwet tot een goed einde kunnen brengen. Voor zover deze minister nog twijfelde over mijn steun, hij heeft hem bij dezen op hoofdlijnen. Het is goed dat Nederland het stelsel van <em>collectieve</em> aanvullende pensioenen behoudt, verder uitbouwt en voor steeds meer mensen beschikbaar maakt. Het is een goede garantie voor de oude dag. En het is al vele"
"nl.proc.ob.d.h-tk-20102011-34-2.1.6.2","nl.proc","speech",0.29249525,"2010-12-14","Ulenbelt","SP","De heer","mp",2,"commons","Ik vroeg niet of de minister met de werknemers wil overleggen, maar of hij de directie van Midreth wil aanspreken dat de handelswijze nu niet in de geest is van de Wet melding <em>collectief</em> ontslag. Dat is namelijk ook de reden dat de minister met een wetswijziging komt. Mijn tweede vraag is of het niet een beetje laat is om pas in het voorjaar met die wet te komen. Wil de minister mij toezeggen dat hij dit allemaal wat sneller doet?"
"nl.proc.ob.d.h-tk-20062007-4345-4355.1.7.3","nl.proc","speech",0.29249525,"2007-06-14","Van der Vlies","SGP","De heer","mp",2,"commons","Ik ben voor zes dagen in de week beschikbaar. Ik vind het zelfs onbegrijpelijk dat de VVD de zondag als een normale dag of, zoals nu maar weer blijkt, als een werkdag wil beschouwen. Denkt de VVD werkelijk dat de samenleving er beter van wordt als er geen enkel <em>collectief</em> rustmoment is in deze samenleving? Mevrouw de Voorzitter. Ik sluit mij graag aan bij de vraagstelling van mijn collega Van Dijk over de vergunning inzake de beveiliging."
"nl.proc.ob.d.h-tk-20102011-32-30.1.12.13","nl.proc","speech",0.29249525,"2010-12-08","Azmani","VVD","De heer","mp",2,"commons","Dat is zeker wat anders. Gelukkig is de WAO verleden tijd en hebben we nu de WIA, die veel beter werkt. Kort gezegd: in cao's staat al veel over arbeidstijden en arbeidsvermeerdering. Je kunt het <em>collectief</em> opleggen, maar dat werkt nooit want het draagvlak moet van onderaf komen. Bovendien is het maatwerk. Volgens mij gebeurt het al en maakt de heer Klaver het hiermee monddood."
"nl.proc.ob.d.h-tk-20052006-6307-6341.1.14.1","nl.proc","speech",0.2900473,"2006-09-06","Van Gent","GroenLinks","Mevrouw","mp",11,"commons","Voorzitter. Ik dank de minister voor zijn beantwoording. Ik wil nog ingaan op enkele punten. Er is verschil van mening in de Kamer over zondagsarbeid, maar het is een debat dat echt ergens over gaat. De discussie gaat over de vraag hoever principes gaan, hoeveel zondagen er mag worden gewerkt en welke zaken <em>collectief</em> moeten worden geregeld en"
"nl.proc.ob.d.h-tk-20102011-34-2.1.5.1","nl.proc","speech",0.2894952,"2010-12-14","Ulenbelt","SP","De heer","mp",2,"commons"," ontslagbescherming. Een van de onderdelen van de ontslagbescherming is dat ontslagen van meer dan 20 mensen aangekondigd moeten worden bij het UWV. De Wet melding <em>collectief</em> ontslag schrijft dat voor. Deze werkgever houdt zich niet aan die wet. Hij wil met 50 mensen, die hij willekeurig kiest, een individuele afspraak over hun ontslag maken. Dat is"
"nl.proc.ob.d.h-tk-20112012-36-12.1.12.1","nl.proc","speech",0.2894952,"2011-12-14","Hamer","PvdA","Mevrouw","mp",12,"commons"," werkzaamheden naar het buitenland worden verplaatst, terwijl er voor uitvoering van deze taken over het algemeen voldoende Nederlandse werknemer beschikbaar zijn; constaterende dat bedrijven momenteel simpel <em>collectief</em> ontslag kunnen aanvragen voor deze overtollige werknemers in Nederland, omdat offshoring een erkende grond voor ontslag is; van mening dat"
"nl.proc.ob.d.h-tk-20092010-52-4812.1.11.15","nl.proc","speech",0.2894952,"2010-02-09","Aasted Madsen-van Stiphout","CDA","Mevrouw","mp",3,"commons"," <em>collectief</em> verhaal. Dat <em>collectief</em> verhaal is immers belangrijk. Ik ben ervan overtuigd dat, als mensen massaal worden gedupeerd doordat tussenhandelaren woekerwinsten willen maken, belangenorganisaties zoals een Consumentenbond die mensen <em>collectief</em> zullen bijstaan bij het verhalen van het te veel betaalde."
