"id","index","type","score","date","speaker","party","function","role","paragraphs_count","house","highlight text"
"nl.proc.ob.d.h-tk-20082009-2744-2756.1.10.28","nl.proc","speech",0.046483066,"2008-12-03","Van Miltenburg","VVD","Mevrouw","mp",1,"commons","De spraakverwarring blijft bestaan. Cliëntenorganisaties en belangenbehartigingsorganisaties gaan altijd uit van een <em>collectieve</em> belangenbehartiging. Dat is hun taak. Daarvoor hebben cliënten hun krachten gebundeld. MEE is als professional gespecialiseerd in individuele belangenbehartiging. Ik vind het zeer ingewikkeld en in feite ook oneigenlijk dat zij nu een gezamenlijke opdracht krijgen, terwijl hun expertise op twee verschillende terreinen ligt."
"nl.proc.ob.d.h-tk-20092010-56-5088.1.9.2","nl.proc","speech",0.046483066,"2010-02-17","Karabulut","SP","Mevrouw","mp",1,"commons","Mevrouw Smilde had in eerste termijn een groot bezwaar, namelijk de eenzijdige financiering door de werkgevers. Evenals de SP-fractie maakte zij zich zorgen over de kleine ondernemers. Dat probleem hebben de initiatiefnemers opgelost door op zoek te gaan naar een <em>collectieve</em> financiering. Mevrouw Smilde vindt dat echter ook geen goed idee. Op welke wijze wil zij een en ander financieren?"
"nl.proc.ob.d.h-tk-20112012-35-32.1.10.10","nl.proc","speech",0.046483066,"2011-12-13","Van Hijum","CDA","De heer","mp",1,"commons","Eerst een kleine politieke plaatsbepaling. Ik vraag wat de agenda van de PVV is bij het algemeen verbindend verklaren en de cao-discussie. Ik schaarde zijn partij altijd in het kamp van de critici, net als de heer Azmani. Het voorstel dat hij nu doet, is erop gericht om het draagvlak onder <em>collectieve</em> afspraken te verdedigen. Hoe moet ik dat duiden?"
"nl.proc.ob.d.h-tk-20062007-4185-4193.1.7.4","nl.proc","speech",0.046483066,"2007-06-07","Van Gerven","SP","De heer","mp",1,"commons","Het is niet waar dat wij niet voor solidariteit of <em>collectieve</em> oplossingen zijn. Wij hadden een betere oplossing in plaats van de Zorgverzekeringswet; gewoon een ziektekostenverzekering met volledige premieheffing naar draagkracht. Verder komt onverzekerdheid zeker voor onder daklozen. Als je dat automatisch regelt, heb je gewoon minder onverzekerden. Dat staat toch als een paal boven water?"
"nl.proc.ob.d.h-tk-20122013-34-5.1.7.5","nl.proc","speech",0.046483066,"2012-12-12","Tony van Dijck","PVV","De heer","mp",1,"commons","Ik heb een vraag over deze motie. Ik begrijp dat de heer Buma er wel mee instemt dat de contracten een goede zaak zouden kunnen zijn voor landen die eventueel in de <em>collectieve</em> arm van de macro-evenwichtighedenprocedure zitten. Realiseert hij zich dat Nederland daarvan maar een heel klein beetje verwijderd is?"
"nl.proc.ob.d.h-tk-20142015-76-6.1.5.16","nl.proc","speech",0.046483066,"2015-04-15","Klever","PVV","Mevrouw","mp",1,"commons","Geldt voor alle <em>collectieve</em> verzekeringen die gemeenten aanbieden dat mensen met een loon tot 120% van het minimum daarvoor in aanmerking komen? Of verschilt dat per gemeente en is het zeker niet zo dat iedereen met een minimumloon daarvoor in aanmerking komt?"
"nl.proc.ob.d.h-tk-20142015-100-4.1.3.7","nl.proc","speech",0.046483066,"2015-06-24","Schut-Welkzijn","VVD","Mevrouw","mp",1,"commons","Daarom hebben wij ook voorstellen gedaan die de lasten verlichten. Als de rekening nu weer bij de overheid komt te liggen — dat hoorde ik namelijk in het voorstel van de heer Van Weyenberg dat hij in het AO deed — gaan de lasten uiteindelijk omhoog. De heer Van Weyenberg weet ook dat een <em>collectieve</em> premie altijd hoger is dan een individuele premie."
"nl.proc.ob.d.h-tk-20142015-29-3.1.6.56","nl.proc","speech",0.046483066,"2014-11-26","Anne Mulder","VVD","De heer","mp",1,"commons","We moeten goed nadenken over de zekerheden voor een zzp'er. We hebben in ons verkiezingsprogramma staan dat moet worden gedacht aan <em>collectieve</em> regelingen, zonder ze te verplichten. Ga eens kijken wat je vrijwillig voor die groep kunt doen bij arbeidsongeschiktheid en pensioenen, zodat ze zich daartegen makkelijker kan verzekeren. Zo krijg je daar wat meer vastigheid, maar niet verplicht. Zo denken wij erover."
"nl.proc.ob.d.h-tk-20082009-5416-5496.1.7.1","nl.proc","speech",0.043577872,"2009-03-26","Pechtold","D66","De heer","mp",15,"commons"," is een gemiste kans om perspectief te bieden en om de echte keuze voor kennis en innovatie te maken. Dat is de enige keuze die mogelijk is voor versterking van de economische structuur. Een fundament voor structureel herstel ontbreekt. Het onderwijs wordt zelfs de dupe van het crisispakket. Immers, de bijdrage aan loonontwikkeling in de <em>collectieve</em>"
"nl.proc.ob.d.h-tk-20112012-55-4.1.8.1","nl.proc","speech",0.043577872,"2012-02-16","Van der Werf","CDA","Mevrouw","mp",17,"commons"," het proces? Een ESCo? En door wie wordt die dan weer gecontroleerd? En wat als die twee bedrijven door een grens worden gescheiden? Is dit met andere woorden een wet van gisteren en vandaag of is het ook een wet van morgen? Waar valt de situatie van zelflevering onder? Een directe lijn? Waar valt <em>collectieve</em> opwekking onder? De minister wijst vaak"
"nl.proc.ob.d.h-tk-20052006-3639-3663.1.16.4","nl.proc","speech",0.043577872,"2006-03-09","Heemskerk","PvdA","De heer","mp",11,"commons","-segment van de dbc's. Het kan dan wenselijk zijn als de NZa corrigeert. Aanmerkelijke marktmacht kan nodig zijn ten opzichte van de zorgverzekeraars, bijvoorbeeld op de markt voor <em>collectieve</em> contracten, om extra voorwaarden te stellen of om extra informatie te vragen van één verzekeraar, zonder dat je de gehele markt van collectiviteiten"
"nl.proc.ob.d.h-tk-20072008-3328-3383.1.11.54","nl.proc","speech",0.043577872,"2008-01-23","Agema","PVV","Mevrouw","mp",12,"commons","Rare bangmakerij is er wel op het punt van Europa: \"Als Europa er niet in slaagt een eenheid te worden en als wij tegelijkertijd niet in staat zijn meer eigen verantwoordelijkheid bij burgers en marktpartijen te leggen, zullen wij grote problemen krijgen met zowel het economische als het maatschappelijke draagvlak voor onze <em>collectieve</em>"
"nl.proc.ob.d.h-tk-20072008-3328-3383.1.13.30","nl.proc","speech",0.043577872,"2008-01-23","Kant","SP","Mevrouw","mp",18,"commons","Ik zei als laatste dat het een goed idee is om ouderen als doelgroep op te nemen in de Wet <em>collectieve</em> preventie volksgezondheid. Dit is een van de aanbeveling van de ouderencommissie. Ik roer nu een onderwerp aan dat eerlijk gezegd wel ernstig is. De rest is ook ernstig, maar dit onderwerp gaat mij bijzonder aan het hart. Wij worden gelukkig"
"nl.proc.ob.d.h-tk-20102011-13-7.1.8.8","nl.proc","speech",0.043577872,"2010-10-26","Pechtold","D66","De heer","mp",16,"commons"," sociale werkvoorziening schiet u onmenselijk door. Uw \"uitstelleritis\" op de arbeidsmarkt gaat ten koste van de volgende generatie. De volgende generatie verdient ook een eerlijke kans op een huis. Als de tijd rijp is, zullen wij u afhelpen van die Balkenende-erfenis, uw angst voor dat H-woord, onze <em>collectieve</em> nationale hypotheekschuld van 600 mld. Maar"
"nl.proc.ob.d.h-tk-20122013-70-9.1.6.1","nl.proc","speech",0.043577872,"2013-04-03","Ouwehand","PvdD","Mevrouw","mp",17,"commons"," Nederland beloofd uiterlijk in 2010 een aantal gebieden op zee te beschermen. Deze wetswijziging is van belang voor die bescherming. Wij zijn dan ook blij dat de wijziging er eindelijk is. De PvdD wijst echter ook op de achterstand en de gebreken. De <em>collectieve</em> rijkdom van de marine natuur vraagt om een scherpe bewaking en bescherming. Het tot nu"
"nl.proc.ob.d.h-tk-20122013-33-13.1.20.1","nl.proc","speech",0.043577872,"2012-12-11","Voortman","GroenLinks","Mevrouw","mp",12,"commons"," <em>collectieve</em> voorzieningen zoals O&O-fondsen. Ik krijg hierop graag een reactie van de minister en overweeg hierover een motie in te dienen. Mijn tweede voorstel aangaande flexibiliteit met zekerheid gaat over pensioenen. Wij zijn van mening dat zzp'ers en flexwerkers gelijke toegang tot pensioenvoorzieningen moeten krijgen. Wij willen voor zzp'ers op dit"
"nl.proc.ob.d.h-tk-20112012-58-6.1.4.1","nl.proc","speech",0.043577872,"2012-03-01","Ulenbelt","SP","De heer","mp",9,"commons"," uitvoeren van die richtlijn in de Nederlandse wet wordt het echter mogelijk gemaakt dat er in cao's, in <em>collectieve</em> arbeidsovereenkomsten, kan worden afgeweken van die gelijke arbeidsvoorwaarden. Dat zou zelfs voor onbeperkte tijd mogelijk zijn. Wat zijn nu te rechtvaardigen uitzonderingen op de gelijke arbeidsvoorwaarden en voorzieningen voor"
"nl.proc.ob.d.h-tk-20082009-5622-5662.1.8.1","nl.proc","speech",0.043577872,"2009-04-01","Van der Vlies","SGP","De heer","mp",11,"commons"," een voorziening anders dan in natura ook een pgb is. Het is echter de vraag of men dat in de toekomst ook nog weet. Ook hier kun je je namelijk de vraag stellen hoe diep het <em>collectieve</em> geheugen gaat. Het wetsvoorstel regelt ook dat gemeenten burgers begrijpelijk dienen te informeren als zij kiezen voor een voorziening anders dan in natura. Prachtig"
"nl.proc.ob.d.h-tk-20132014-78-23.1.6.1","nl.proc","speech",0.043577872,"2014-04-22","Voortman","GroenLinks","Mevrouw","mp",12,"commons"," wet die voorligt langs de uitgangspunten van GroenLinks leggen. Voor ons eindoordeel is van belang of wij er vertrouwen in hebben dat op deze punten wezenlijke verbeteringen ten opzichte van wat er nu voorligt te bereiken zijn. De punten die ik wil langslopen — het zijn er zes — zijn de volgende. Ten eerste de <em>collectieve</em> zeggenschap van de mensen"
"nl.proc.ob.d.h-tk-20112012-70-11.1.9.1","nl.proc","speech",0.043577872,"2012-03-29","Hachchi","D66","Mevrouw","mp",11,"commons"," overeenkomen of als dit is vastgelegd in een <em>collectieve</em> arbeidsovereenkomst tussen vertegenwoordigers van werknemers en werkgevers. De onderliggende gedachte van het arbeidsrecht is dat de werknemer en de werkgever gelijkwaardig aan elkaar moeten zijn. Ik kan mij dan ook volledig vinden in het uitgangspunt van de indieners dat voor ambtenaren"
"nl.proc.ob.d.h-tk-20092010-22-1820.1.8.1","nl.proc","speech",0.043577872,"2009-11-10","Jan de Vries","CDA","De heer","mp",14,"commons"," basispakket zorg toegang kan hebben tot de zorg die hij of zij nodig heeft. Daarbij horen vanzelfsprekend een verzekeringsplicht, een acceptatieplicht en een betaalbare premie. De betaalbaarheid van de zorg is niet alleen een zorg van de overheid, maar van iedere premiebetaler. Uiteindelijk moeten wij met elkaar die zorg betalen, via <em>collectieve</em>"
"nl.proc.ob.d.h-tk-20062007-439-469.1.6.1","nl.proc","speech",0.043577872,"2006-10-04","Crone","PvdA","De heer","mp",7,"commons"," moeten worden uitgekleed. De afgelopen vier jaar is dat ook zo gebeurd. De constante lijn zal zijn: vóór de verkiezingen worden gouden bergen beloofd, maar na de verkiezingen is er veel oud lood, koopkrachtverlies en beperking van de <em>collectieve</em> sector. De tweede correctie op de uitspraak van Ayaan Hirsi Ali is dat niet vijf mensen in de"
"nl.proc.ob.d.h-tk-20072008-3696-3717.1.8.2","nl.proc","speech",0.043577872,"2008-02-06","Kant","SP","Mevrouw","mp",16,"commons"," te dringen, moet je eigenlijk zelfs een overschot hebben. Mijn fractie maakt een minder nadrukkelijke keuze voor alleen die staatsschuld. Wij richten ons ook op allerlei andere belangrijke maatschappelijke zaken en investeringen. Wij geven zowel staatsschuld als <em>collectieve</em> voorzieningen door aan de volgende generatie. Het gaat meer in het algemeen"
"nl.proc.ob.d.h-tk-20092010-38-3686.1.8.1","nl.proc","speech",0.043577872,"2009-12-16","Weekers","VVD","De heer","mp",14,"commons"," uitgesproken dan ook goed. De stimulering had beter gezocht kunnen worden in een tijdelijke verlaging van bijvoorbeeld de overdrachtsbelasting op woningen of de btw op de bouw, om daarmee een aanjaageffect te hebben op de woningmarkt, dan in <em>collectieve</em> uitgavenprogramma's die ambtenaren uiteindelijk niet op tijd rond kunnen krijgen. Waarom blijft"
"nl.proc.ob.d.h-tk-20112012-78-5.1.14.1","nl.proc","speech",0.043577872,"2012-04-18","Karabulut","SP","Mevrouw","mp",20,"commons"," kan het ook op een andere manier, juist door afspraken te maken met alle partijen. Dat is echter helaas niet de route die het kabinet kiest. Ik heb op dit punt een aantal moties. Motie De Kamer, gehoord de beraadslaging, spreekt zich uit voor het laten voortbestaan van de <em>collectieve</em> arbeidsovereenkomst voor de sociale werkvoorziening, en gaat over tot de orde van de dag. Deze motie is voorgesteld door de leden Karabulut en Hamer. Naar mij blijkt, wordt de indiening ervan voldoende ondersteund. Zij krijgt nr. 76 (33161) ."
"nl.proc.ob.d.h-tk-20102011-71-7.1.8.1","nl.proc","speech",0.043577872,"2011-04-07","Groot","PvdA","De heer","mp",14,"commons"," op. De grondslag voor de zorgpremie gaat met € 15.000 omhoog tot de premiegrens werknemersverzekeringen. Hierdoor komt zo'n 80% van de verdiende inkomens in dit land onder de inkomensafhankelijke zorgpremie te vallen. Dat leidt vervolgens tot veel minder zorgtoeslagen, maar nog belangrijker is dat zo ook het draagvlak voor de <em>collectieve</em>"
"nl.proc.ob.d.h-tk-20112012-7-26.1.10.1","nl.proc","speech",0.043577872,"2011-10-04","Koşer Kaya","D66","Mevrouw","mp",13,"commons"," aantal mensen gaat. Ik hoop dan ook op brede steun van de Kamer. Het kabinet normeert het minimabeleid van de gemeenten. Gemeentelijke bijstand mag niet meer indien het inkomen van de ontvanger hoger is dan 110% van het minimumloon. Het gaat om de langdurigheidstoeslag, de <em>collectieve</em> zorgverzekering, participatieregelingen, duurzame"
"nl.proc.ob.d.h-tk-20112012-35-32.1.5.1","nl.proc","speech",0.043577872,"2011-12-13","Van Hijum","CDA","De heer","mp",13,"commons",". Een mooi voorbeeld daarvan is de hoveniersbranche, waarmee ik vorige week een gesprek heb gevoerd. Deze branche wil heel graag dit instrument gebruiken om de <em>collectieve</em> afspraken die hij wil maken over budgetten voor scholing, gezondheid en vrije tijd te storten in de vitaliteitsregeling, zodat op de werkvloer heel concreet afspraken kunnen worden"
"nl.proc.ob.d.h-tk-20102011-25-38.1.15.1","nl.proc","speech",0.043577872,"2010-11-23","Verhoeven","D66","De heer","mp",16,"commons",". Ik kom bij de lastenverlichting. Het kabinet verlaagt de vennootschapsbelasting met 500 mln. per jaar. Dat klinkt mooi, maar wie echt lasten wil verlichten, moet minder verplichten. Ik doel op alle heffingen voor gedwongen deelname aan <em>collectieve</em> instituties, de Kamers van Koophandel en de product- en bedrijfschappen. Jaarlijks betalen"
"nl.proc.ob.d.h-tk-20122013-5-6.1.11.1","nl.proc","speech",0.043577872,"2012-09-26","Bouwmeester","PvdA","Mevrouw","mp",16,"commons"," dilemma. Graag een reactie van de minister hierop. Zoals ik al meerdere keren heb gezegd, vinden wij het versterken van de rechten van consumenten zeer belangrijk. Op 3 november 2011 heeft de Kamer een motie aangenomen die de regering opdraagt om met een stappenplan voor <em>collectieve</em> schadeafhandeling door consumentenorganisaties te komen en dit"
"nl.proc.ob.d.h-tk-20122013-8-6.1.11.1","nl.proc","speech",0.043577872,"2012-10-03","Klaver","GroenLinks","De heer","mp",11,"commons"," fixatie op enkel economische groei en dat het tijd werd om na te denken over een breder welvaartsbegrip. Dat neemt in de beleidsdoelen nu geen centrale plaats meer in. Ik citeer opnieuw, dit keer uit de Miljoenennota 2008. \"Komende generaties erven niet alleen de financiële randvoorwaarden voor het continueren van het huidige niveau van de <em>collectieve</em>"
"nl.proc.ob.d.h-tk-20132014-25-40.1.10.5","nl.proc","speech",0.043577872,"2013-11-19","Albert de Vries","PvdA","De heer","mp",11,"commons"," en laatste onderwerp is de rijksdienst. Als partijen zeggen dat wij een te grote overheid hebben, bedoelen zij volgens mij dat wij een grote <em>collectieve</em> sector hebben. Dat komt dan door ons excellente onderwijs, de goede zorg en het robuuste socialezekerheidsstelsel. Zelfs als je dat allemaal meetelt, blijkt Nederland nog tot de staartgroep in"
"nl.proc.ob.d.h-tk-20122013-75-41.1.7.1","nl.proc","speech",0.043577872,"2013-04-16","Schouten","ChristenUnie","Mevrouw","mp",12,"commons"," individuele overheden. De waterschappen worden individueel verantwoordelijk gehouden voor het overschrijden van de macronorm en krijgen alleen een boete opgelegd als zij hebben bijgedragen aan de overschrijding. Deze keuze is door nood gedwongen omdat een <em>collectieve</em> omslag bij waterschappen niet mogelijk is. Omgekeerd kan ook de vraag worden"
"nl.proc.ob.d.h-tk-20142015-25-23.1.5.1","nl.proc","speech",0.043577872,"2014-11-18","Van Bommel","SP","De heer","mp",11,"commons"," blokkade noemde hij eerder al een <em>collectieve</em> straf. Ik vraag hem of dit nog steeds zijn standpunt is en of hij bereid is om er bij Israël op aan te dringen dat de wederopbouw mogelijk wordt gemaakt. Ook vraag ik hem opnieuw naar Gaza te gaan, om daar met eigen ogen de verwoestingen te kunnen waarnemen.  De vraag is welke kant het nu op moet. Terecht"
"nl.proc.ob.d.h-tk-20152016-23-3.1.7.1","nl.proc","speech",0.043577872,"2015-11-11","Knops","CDA","De heer","mp",11,"commons"," unieke verantwoordelijkheid die wij hebben voor onze <em>collectieve</em> veiligheid, de erkenning en het besef dat de overheid hier een directe verantwoordelijkheid heeft, kabinet en Kamer, alle 150 leden in dit parlement, zoals wij hier zitten. Er bestaat namelijk niet zoiets als SP-veiligheid of PvdA-veiligheid. Veiligheid gaat elke inwoner van Nederland"
"nl.proc.ob.d.h-tk-20142015-52-24.1.6.1","nl.proc","speech",0.043577872,"2015-02-10","Helder","PVV","Mevrouw","mp",16,"commons"," zijn van een <em>collectieve</em> rechtenorganisatie ontvangen makersvergoeding gedeeltelijk terug te betalen aan de opdrachtgever, onredelijk bezwarend is. Zijn die twee zaken niet tegenstrijdig?  Ten derde, op pagina 13 van de memorie van toelichting is te lezen dat de minister van OCW de hoogte van de billijke vergoeding kan bepalen die de maker toekomt"
"nl.proc.ob.d.h-tk-20142015-2-8.1.13.1","nl.proc","speech",0.043577872,"2014-09-17","Klein","50PLUS/Klein","De heer","mp",11,"commons",". Bij de behandeling van het Belastingplan zal ik er dan ook graag op terugkomen door te kiezen voor een open, eerlijk stelsel, zonder schijnoplossingen met overbodige toeters en bellen.  Met ons pensioenstelsel is iets gruwelijk misgegaan tussen enerzijds de werkelijkheid van een solide, <em>collectieve</em> financiële voorziening en anderzijds de perceptie"
"nl.proc.ob.d.h-tk-20052006-6307-6341.1.6.5","nl.proc","speech",0.041785035,"2006-09-06","Van Gent","GroenLinks","Mevrouw","mp",1,"commons"," reden om op zondag niet te willen werken. Dat moet mogelijk zijn. Daar sta ik nog steeds volledig achter. Maar het gaat mij te ver om dat nu voor iedereen <em>collectief</em> te op te leggen. De haven van rust in jachtige tijden kan wat mij betreft ook op andere tijden dan per se de zondag. Ik respecteer het als mensen daarvoor de zondag kiezen."
"nl.proc.ob.d.h-tk-20092010-97-7965.1.6.5","nl.proc","speech",0.041785035,"2010-09-08","Van Hijum","CDA","De heer","mp",1,"commons","Volgens mij is dat de boodschap ook. Onnodig korten wil natuurlijk niemand, het CDA niet, de hele samenleving niet. Wij staan voor het behoud van een <em>collectief</em>, solidair pensioenstelsel. Maar daarvoor is het ook nodig dat je de reële situatie van de fondsen onder ogen ziet en dat je de in 2006 afgesproken spelregels in het financieel"
"nl.proc.ob.d.h-tk-20092010-1368-1407.1.8.41","nl.proc","speech",0.041785035,"2009-10-29","Vendrik","GroenLinks","De heer","mp",1,"commons"," over ABN AMRO. Dat vind ik echt slap. Het is een staatsbank geworden. Wij hebben er <em>collectief</em> een groot belang bij dat er maatschappelijk verantwoord wordt gebankierd. Maatschappelijk verantwoord ondernemen is een van de speerpunten van het beleid van de staatssecretaris. Ik zou zeggen, staatssecretaris, checkt u dit eens even bij de bank. Doet u mij een lol door ons een brief toe te sturen voorafgaand aan het algemeen overleg over maatschappelijk verantwoord ondernemen."
"nl.proc.ob.d.h-tk-20052006-2768-2801.1.11.7","nl.proc","speech",0.041785035,"2006-01-26","Rouvoet","ChristenUnie","De heer","mp",1,"commons"," <em>collectief</em> geregeld en verzekerd kan worden, waar nodig meer beroep te doen op mensen om tot mantelzorg en vrijwilligerswerk te komen. Dat kan op allerlei mogelijke manier worden gestimuleerd. Daar zijn prachtige voorbeelden van. Een beroep doen op mensen mag zeker. Zij moeten echter ook daartoe in de gelegenheid worden gesteld. Zij moeten mogelijkheden en instrumenten krijgen."
"nl.proc.ob.d.h-tk-20082009-4257-4274.1.13.5","nl.proc","speech",0.041785035,"2009-02-05","Van Miltenburg","VVD","Mevrouw","mp",1,"commons"," wordt dat zij bijplussen omdat dit soort dingen zijn gedaan om te voorkomen dat Meavita failliet gaat, kan ik mij voorstellen dat gemeenten zeggen: dat gaan wij niet voor onze rekening nemen. Dat zou dan betekenen dat die betreffende gemeente doet wat de staatssecretaris niet wenselijk vindt, namelijk geen verantwoordelijkheid nemen voor het <em>collectief</em>, maar alleen voor haar eigen inwoners. De gemeenteraad lijkt mij de juist plek om dat te doen."
"nl.proc.ob.d.h-tk-20072008-6115-6150.1.7.37","nl.proc","speech",0.041785035,"2008-05-22","Hamer","PvdA","Mevrouw","mp",1,"commons"," aan het werk worden geholpen. Ik zal de commissie-Bakker zaterdag een handje helpen door zelf met een aantal voorstellen voor de onderkant van de arbeidsmarkt te komen, waarin wij inderdaad regelingen zullen vereenvoudigen en waarmee wij ervoor zullen zorgen – anders wordt mevrouw Halsema zo ongeduldig – dat er niet <em>collectief</em> gestraft wordt, maar mensen individueel maatwerk aangeboden krijgen."
"nl.proc.ob.d.h-tk-20122013-32-2.1.7.77","nl.proc","speech",0.041785035,"2012-12-06","Leijten","SP","Mevrouw","mp",1,"commons"," moeder die een goed dag-nachtritme heeft via haar dagbesteding. Ik heb in mijn eerste termijn gevraagd wat de staatssecretaris zegt tegen dit meisje en deze moeder: ik heb mijn begroting op orde, je moet meer zelf gaan doen, het is nu eenmaal een onbegaanbare weg om het <em>collectief</em> te blijven betalen? Ik ben daar wel benieuwd naar. Het is geen jeugdzorgvraag maar een vraag over het behoud van de dagbesteding van die moeder in de toekomst."
"nl.proc.ob.d.h-tk-20082009-2117-2141.1.19.1","nl.proc","speech",0.041785035,"2008-11-18","Ouwehand","PvdD","Mevrouw","mp",19,"commons"," Nederland. Ik kom nog even terug op het ammoniakprobleem. Jarenlang maakten de collega's van deze minister een dermate zootje van het beleid, dat bezorgde burgers zich hebben verenigd en hebben besloten de rechtmatigheid van afgegeven ammoniakvergunningen te laten toetsen door de rechter. Het milieu is immers een <em>collectief</em> goed, maar dit dreigt nu"
"nl.proc.ob.d.h-tk-20112012-8-2.1.6.77","nl.proc","speech",0.041785035,"2011-10-05","Plasterk","PvdA","De heer","mp",1,"commons","Wij controleren de regering. Zeventien regeringsleiders hebben dit allemaal op die dag zo met elkaar besloten. Wij kunnen hen alleen maar <em>collectief</em> aansprakelijk stellen. Ik kan wel wat zeggen over dat Finse onderpand. Bij navraag bleek er op pagina 9 wel zoiets te staan als \"where appropriate\" en \"collateral can be\". In zo'n zinnetje kon toch"
"nl.proc.ob.d.h-tk-20112012-36-12.1.6.142","nl.proc","speech",0.041785035,"2011-12-14","Hamer","PvdA","Mevrouw","mp",1,"commons","Als ik de minister zo hoor, zijn we het eens. Mijn voorstel is juist om het automatisme dat je <em>collectief</em> ontslag krijgt als je naar het buitenland gaat, te laten vervallen. In andere gevallen is dat namelijk helemaal geen grond voor ontslag. Mijn voorstel is niet om bedrijven te verbieden om een deel van het werk naar het buitenland te brengen"
"nl.proc.ob.d.h-tk-20132014-42-10.1.6.4","nl.proc","speech",0.041785035,"2014-01-16","Van Gerven","SP","De heer","mp",1,"commons"," hij heeft gedaan. Dan gaat het er bij mij en bij heel veel mensen niet in dat je ervanaf komt door te zeggen dat het <em>collectief</em> heeft gefaald, verantwoordelijk was en beboet wordt, maar dat mensen persoonlijk buiten schot blijven. Dat kan geen rechtvaardige uitkomst zijn in zo'n belangrijke principiële kwestie."
"nl.proc.ob.d.h-tk-20132014-78-23.1.5.45","nl.proc","speech",0.041785035,"2014-04-22","Siderius","SP","Mevrouw","mp",22,"commons"," introduceert. De staatssecretaris zegt dat het stelsel simpeler wordt omdat mensen eerder gebruik konden maken van drie domeinen — de Zorgverzekeringswet, de gemeenten en de AWBZ — terwijl het straks nog maar twee domeinen zijn. Waarom kiest de staatssecretaris niet voor een simpeler stelsel waarbij alle zorg <em>collectief</em> wordt georganiseerd en bekostigd door"
"nl.proc.ob.d.h-tk-20092010-23-1912.1.6.30","nl.proc","speech",0.041785035,"2009-11-11","Wiegman-van Meppelen Scheppink","ChristenUnie","Mevrouw","mp",1,"commons"," beter binnen de Wmo past. Daarop zouden gemeenten hun welzijnswerk kunnen richten. Eigenlijk zou ik een dergelijke operatie ook van deze minister verwachten als het gaat om de ggz, juist met de grote, tijdens de heroverweging te beantwoorden vraag in het achterhoofd welke zorg we nu echt met elkaar, <em>collectief</em>, willen betalen, verzekeren en regelen en de grote vraag welke onderdelen er eigenlijk zomaar in zijn ondergebracht, maar op een andere manier goed opgevangen kunnen worden voor de mensen die er gebruik van maken?"
