"id","index","type","score","date","speaker","party","function","role","paragraphs_count","house","highlight text"
"nl.proc.ob.d.h-tk-20072008-3205-3226.1.7.1","nl.proc","speech",0.10446259,"2008-01-16","Depla","PvdA","De heer","mp",5,"commons"," overgenomen over de klachtencommissie. Dat lijkt mij prima. Zo willen wij dat graag hebben. Ik ben blij dat het initiatiefrecht er komt. Wij zullen afwachten hoe dit precies gebeurt. Wij wachten ook het antwoord van de minister af op de vraag of je over servicekosten <em>collectief</em> in beroep kunt gaan bij de huurcommissie, zodat je niet elk jaar allemaal apart"
"nl.proc.ob.d.h-tk-20122013-71-10.1.7.1","nl.proc","speech",0.10446259,"2013-04-04","Van Ojik","GroenLinks","De heer","mp",15,"commons"," gezamenlijk optreden; verzoekt de regering, in te zetten op een ambitieus <em>collectief</em> EU-aanbod aan de UNHCR om een substantieel aantal Syrische vluchtelingen in de EU op te nemen en door middel van burden sharing de vluchtelingen over de EU-lidstaten te verdelen; verzoekt de regering tevens, met deze inzet af te reizen naar de conferentie over de opvang"
"nl.proc.ob.d.h-tk-20122013-14-3.1.18.1","nl.proc","speech",0.10446259,"2012-10-24","Agnes Mulder","CDA","Mevrouw","mp",7,"commons"," waarop mensen <em>collectief</em> bezig kunnen zijn met zingeving, met hun gezin, met sport, met hobby's en met ontmoeting. Eén dag is er als baken van rust in de hectische week. Als ik op die ene dag per se wil winkelen, zoek ik een stad uit waar ik dat kan doen. Of ik ga het internet op. De webwinkels zijn 24 uur per dag open. Daar kan ik mijn gang gaan. Het leven draait om meer dan alleen kopen, kopen, kopen. Het verbaast mij dan ook dat een groene partij als GroenLinks zich zo laat leiden door de neoliberale agenda."
"nl.proc.ob.d.h-tk-20132014-78-23.1.5.1","nl.proc","speech",0.10446259,"2014-04-22","Siderius","SP","Mevrouw","mp",5,"commons"," stelsel opgebouwd van <em>collectief</em> gefinancierde zorg waar iedereen, ongeacht het inkomen, in gelijke mate recht op had, dit vanuit de gedachte dat zorg een taak is van de overheid die niet overgelaten kan worden aan particuliere initiatieven of kerkelijke gunsten. Deze gedachte kwam voort uit het besef dat de samenleving een gezamenlijke"
"nl.proc.ob.d.h-tk-20082009-1741-1766.1.10.5","nl.proc","speech",0.10446259,"2008-11-11","Agema","PVV","Mevrouw","mp",5,"commons"," kopiëren een nepwereld uit videoclips waarin vrouwen de rol van hoer en mannen die van pooier spelen in een luilekkerland van luxe. De minister kan verrast zijn door woorden als \"wanga\" en \"tanga\", maar hij is gewoon een ongelooflijk lieve en vreselijk naïeve schat. Heeft de minister wel eens 300 jongeren <em>collectief</em> zien \"schuren\" in een discotheek"
"nl.proc.ob.d.h-tk-20102011-61-10.1.15.3","nl.proc","speech",0.10446259,"2011-03-16","Plasterk","PvdA","De heer","mp",14,"commons"," er is geen reden waarom de samenleving <em>collectief</em> verantwoordelijk zou moeten worden gehouden voor het risico van handelen in schulden. De regering heeft erop gewezen, grote aarzeling te hebben om deze aanbeveling te volgen, en geeft daarvoor een aantal praktische argumenten. We moeten deze praktische argumenten serieus wegen, maar ik ben er"
"nl.proc.ob.d.h-tk-20062007-5024-5047.1.11.18","nl.proc","speech",0.10446259,"2007-07-04","Hamer","PvdA","Mevrouw","mp",4,"commons"," hoe het zit met het toegezegde onderzoek naar de effecten van de nieuwe WW. Ten slotte wil ik graag van de minister weten hoe het nu precies zit met de ontslagprocedures. Komt er één procedure, of blijven er toch diverse routes bestaan: de korte route, de route via de rechter, de route via het CWI en een aparte route voor het <em>collectief</em> ontslag? De"
"nl.proc.ob.d.h-tk-20092010-27-2471.1.8.28","nl.proc","speech",0.10446259,"2009-11-19","Gesthuizen","SP","Mevrouw","mp",5,"commons"," dit wetsvoorstel. Wij willen slechts misbruik tegengaan van de uitzonderingsmogelijkheden die de wet biedt. Waarom willen we dat? Omdat SP en SGP beide menen dat het belangrijk is dat er één dag is die zo veel mogelijk een <em>collectief</em> vrije dag is en dat dit in ons land de zondag dient te zijn. Voor de SP geldt dat wij de zondag zien als de meest"
"nl.proc.ob.d.h-tk-20132014-52-2.1.6.1","nl.proc","speech",0.10446259,"2014-02-11","Oskam","CDA","De heer","mp",5,"commons"," veld en dat wij elkaar daarin moeten steunen. Ik maak mij sterk voor het tegengaan van geweld in de sport. Ik doe dat samen met andere Kamerleden. Juist vanwege mijn ervaring als oud-scheidsrechter betaald voetbal en voorzitter van de KNVB West II heb ik mij daar extra voor ingezet. Sporten moet een feest zijn, zonder geweld. Het is een <em>collectief</em>"
"nl.proc.ob.d.h-tk-20102011-67-2.1.11.6","nl.proc","speech",0.10446259,"2011-03-30","Çörüz","CDA","De heer","mp",4,"commons"," niet zo was, zou ik voorstellen om iets te creëren omdat dat waarde heeft, maar je kunt individueel dan wel <em>collectief</em> tot bij de hoogste rechter in Straatsburg je recht uitoefenen. Ik ben mij dus op grond van deze vier toch inhoudelijke argumenten eigenlijk steeds meer gaan afvragen wat nu de toegevoegde waarde is van het creëren van een procesbevoegdheid."
"nl.proc.ob.d.h-tk-20122013-17-2.1.4.138","nl.proc","speech",0.10446259,"2012-10-31","Mark Rutte","VVD","De heer","mp",4,"commons",", <em>collectief</em> de ministeriële verantwoordelijk nemen voor de Koningin, voor het staatshoofd, in de komende jaren. Dat is dan misschien nog niet formeel, maar wel de facto het geval. Dat is één kant van de zaak: het belang van het bewaken van dat belangrijke en waardige moment. Aan de andere kant heeft de Kamer in een motie het verzoek neergelegd om over te"
"nl.proc.ob.d.h-tk-20102011-19-29.1.14.24","nl.proc","speech",0.10446259,"2010-11-09","Uitslag","CDA","Mevrouw","mp",4,"commons","Ik vind het jammer dat mevrouw Leijten dit soort zaken weer zo neerzet alsof het alleen om geld en bezuinigen gaat. Ik ben er echt van overtuigd dat deze manier van decentraliseren – dichtbij de mensen, waar zij wonen, en <em>collectief</em>, wat mensen nodig hebben – heel goed werkt. Nogmaals: we zullen de vinger op deze plek blijven leggen en we zullen"
"nl.proc.ob.d.h-tk-20102011-34-56.1.9.3","nl.proc","speech",0.10446259,"2010-12-14","Dijkhoff","VVD","De heer","mp",6,"commons"," ontwikkelingssamenwerking gaat het voor de VVD om resultaten. Het omvormen van het ontwikkelingsbeleid moet in het teken staan van hetgeen wij daadwerkelijk bereiken bij het helpen van mensen om zich te ontwikkelen. De VVD wil geen overheid die een <em>collectief</em> \"moeder Theresa\"-complex afkoopt met een kille kasschuif. De VVD wil beleid dat wordt geroemd om de"
"nl.proc.ob.d.h-tk-20082009-4439-4442.1.5.1","nl.proc","speech",0.10446259,"2009-02-17","Smits","SP","Mevrouw","mp",13,"commons"," samenleving als zij niet meer met jongeren wil praten maar ze gewoon wegjaagt? Welke plek zouden jongeren in onze samenleving volgens ons nu moeten hebben? Om die vraag gaat het! De SP wil jongeren niet <em>collectief</em> wegjagen, maar vindt dat je naar menselijke oplossingen moet zoeken. Voor het geval dat het collega-Kamerleden is ontgaan: jongeren zijn"
"nl.proc.ob.d.h-tk-20122013-65-4.1.8.1","nl.proc","speech",0.10446259,"2013-03-21","Leijten","SP","Mevrouw","mp",3,"commons"," grootte een probleem wordt voor het goed aansturen van de instelling. Je zult maar familie hebben in een instelling in Amsterdam die <em>collectief</em> onder verscherpt toezicht wordt gesteld, waarbij de analyse van eigenlijk iedereen is: deze organisatie is te groot om het nog op orde te krijgen. Daarom waren wij blij met de opsplitsingsbevoegdheid. Daarom"
"nl.proc.ob.d.h-tk-20112012-53-29.1.16.1","nl.proc","speech",0.10446259,"2012-02-14","Peters","GroenLinks","Mevrouw","mp",3,"commons"," tarieven gebeuren, want die tarieven worden opgelegd door een marktmonopolist die de vrijemarktverhoudingen verstoort, in plaats van door een vrije contractuele partij. Daardoor is het voor afnemers moeilijk om erover te onderhandelen. Zij kunnen ex post wel terugvallen op de geschillencommissie, maar gelet op de brede werking van zo'n <em>collectief</em>"
"nl.proc.ob.d.h-tk-20052006-3013-3035.1.15.1","nl.proc","speech",0.10446259,"2006-02-02","Wilders","Groep Wilders","De heer","mp",6,"commons","Voorzitter. Vandaag gaat het erom dat wij verantwoordelijkheid nemen voor vrijheid, dat wij een bijdrage leveren aan vrijheid, vrijheid in Afghanistan door wederopbouw en terrorismebestrijding. Het is goed om ons te realiseren dat als Nederland, als de rest van de internationale gemeenschap dat niet doet en wij <em>collectief</em> de andere kant op kijken"
"nl.proc.ob.d.h-tk-20082009-7210-7223.1.11.3","nl.proc","speech",0.10446259,"2009-06-03","Atsma","CDA","De heer","mp",4,"commons"," <em>collectief</em> lijkt te gebeuren. Vandaag had iemand het over lekker boertjes bashen. Ik vind dat jammer. Boeren verdienen dat niet. De Nederlandse ondernemers verdienen het niet. De Europese boeren verdienen het niet. Ook de wereld verdient het niet. Ik zeg dit bewust in deze volgorde, omdat wij twee of drie weken geleden met een aantal collega's in New"
"nl.proc.ob.d.h-tk-20072008-997-1018.1.6.10","nl.proc","speech",0.10446259,"2007-10-18","De Pater-van der Meer","CDA","Mevrouw","mp",4,"commons"," doen, maar wat <em>collectief</em> gebeurt. In mijn schriftelijke bijdrage aan dit wetsvoorstel heb ik erop gewezen dat dit voor een aantal gemeenten zeer onredelijk kan uitpakken. Gemeenten die geen tariefsverhoging doorvoeren, worden op dezelfde manier gekort als gemeenten die meer dan trendmatig verhogen. De goede gemeenten lijden dus onder de kwade! Dat"
"nl.proc.ob.d.h-tk-20112012-72-6.1.13.11","nl.proc","speech",0.10446259,"2012-04-04","Wolbert","PvdA","Mevrouw","mp",3,"commons"," volgen. De Partij van de Arbeid maakt zich wel grote zorgen over het effect op de medewerkers in de zorg die nu begeleiding bieden. We hebben in de vorige kabinetsperiode gezien hoe de verzorgenden in de thuiszorg eerst in dienst mochten blijven, maar toen de thuisorganisaties ontdekten dat ze te duur waren, werden ze <em>collectief</em> ontslagen. Ze"
"nl.proc.ob.d.h-tk-20142015-20-9.1.10.3","nl.proc","speech",0.10446259,"2014-11-05","Jasper van Dijk","SP","De heer","mp",15,"commons"," uitgeloot, is dan volledig buiten zijn schuld aangewezen op het leenstelsel als hij iets anders gaat studeren. Is het dan niet volstrekt redelijk om die student niet lastig te vallen met een leenstelsel? Maar nee, helaas. De minister heeft al mijn amendementen <em>collectief</em> ontraden. Gelukkig kan de Kamer nog zelfstandig oordelen. Althans, ik hoop dat"
"nl.proc.ob.d.h-tk-20142015-104-11.1.6.3","nl.proc","speech",0.10446259,"2015-07-02","Van Weyenberg","D66","De heer","mp",4,"commons"," blijven, 19 worden ontslagen. Ik vraag de minister het volgende. Is dat getal van 19 toeval, of heeft dat er iets mee te maken dat je als je er 20 zou ontslaan in de procedure van <em>collectief</em> ontslag terechtkomt? Het getal maakte mij wat argwanend. Klopt het nou dat 19 mensen hun baan verliezen, ondanks de beloftes in de kabinetsbrief? Ik twijfel niet"
"nl.proc.ob.d.h-tk-20152016-10-28.1.13.60","nl.proc","speech",0.10446259,"2015-10-06","Jan Vos","PvdA","De heer","mp",45,"commons","Geheel tegen mijn aard in pas ik en lees ik mijn tweede motie voor.  Motie De Kamer,  gehoord de beraadslaging,  overwegende dat de energietransitie in toenemende mate wordt gedreven door burgers en bedrijven die individueel of <em>collectief</em> gebruik willen maken van zonne-energie, windenergie, groen gas en duurzame warmte;  overwegende dat hierdoor"
"nl.proc.ob.d.h-tk-20142015-56-8.1.5.18","nl.proc","speech",0.10446259,"2015-02-25","Van Bommel","SP","De heer","mp",5,"commons"," ging om private beleggers. Dat was dus een heel ander verhaal. Het gaat er nu, op de korte termijn en met een bankrun voor de deur, om of je de Grieken helemaal laat omvallen en hen <em>collectief</em>, allemaal laat stikken, en daarmee ook al het geld verliest dat je erin hebt gestoken, of dat je dat niet doet. Dan kiezen wij voor het laatste.  Het is een"
"nl.proc.ob.d.h-tk-20142015-16-13.1.6.30","nl.proc","speech",0.10446259,"2014-10-28","Lodders","VVD","Mevrouw","mp",4,"commons",", komen we terug bij de productschappen-light. Ik denk dat het een heel sterke gedachte van de sector is om met elkaar dat <em>collectief</em> te vormen. Als 80% à 90% van de boeren daar straks lid van is, heb je die algemeenverbindendverklaring echt niet nodig. De sector zal die waarde zelf ook gaan inzien. Daar ben ik van overtuigd.  We zijn er nog niet"
"nl.proc.ob.d.h-tk-20142015-89-5.1.5.1","nl.proc","speech",0.10446259,"2015-05-28","Karabulut","SP","Mevrouw","mp",7,"commons"," waarmee de banken laten zien dat zij eigenlijk schijt of, iets parlementairder gezegd, lak hebben aan de mensen, aan het <em>collectief</em>, is dat een hele hoop banken zeggen dat zij niet meewerken aan het oplossen van de toezichtsbelemmerende bepalingen, waaronder zeven contracten bij de bank die tot nu toe nog steeds een staatsbank is, ABN AMRO. Ik wil"
"nl.proc.ob.d.h-tk-20052006-6307-6341.1.8.13","nl.proc","speech",0.10271403,"2006-09-06","Van der Vlies","SGP","De heer","mp",3,"commons"," minste vier zondagen in elke periode van dertien achtereenvolgende weken geen arbeid verricht? Waarom is het mogelijk gemaakt dat er bij <em>collectieve</em> regeling, in ultieme termen geredeneerd, in het vervolg op elke zondag kan worden gewerkt? De huidige wet stelt dat dit op 4 zondagen per 13 weken niet kan. Als er afgeweken wordt, kan dit niet tot meer"
"nl.proc.ob.d.h-tk-20112012-31-10.1.12.1","nl.proc","speech",0.10271403,"2011-12-01","Koopmans","CDA","De heer","mp",6,"commons"," doet in het amendement op stuk nr. 30 om de <em>collectieve</em> beheersorganisaties, de Buma/Stemra's, aan te pakken. Ik ben er nog niet helemaal zeker van, zo zeg ik eerlijkheidshalve, of dat via dit amendement moet gebeuren of dat wij een andere methode moeten kiezen. De <em>collectieve</em> beheersorganisaties zijn niet publiek. Ik deel het doel, maar ben op zoek"
"nl.proc.ob.d.h-tk-20052006-2768-2801.1.10.14","nl.proc","speech",0.10271403,"2006-01-26","Verbeet","PvdA","Mevrouw","mp",5,"commons","Voorzitter. Voor een evaluatie of een monitor is het nodig om de ontwikkelingen in de verdeling van de uitgaven tussen <em>collectieve</em> en individuele voorzieningen te monitoren. Zo kan de gemeente de burgers duidelijk maken welk deel van haar budget zij ten behoeve van maatschappelijke ondersteuning heeft ingezet. Mijn fractie stelt tevens voor, dat"
"nl.proc.ob.d.h-tk-20052006-5702-5719.1.6.6","nl.proc","speech",0.10271403,"2006-06-21","Heemskerk","PvdA","De heer","mp",10,"commons"," categorie 3, maar categorie 4 zijn. Dat kunnen wij nu regelen. Ik hoop dus dat u dit zult steunen. Ik wil het ook nog hebben over de <em>collectieve</em> garantieregeling. Helaas is er voor het eerst in zeer lange tijd een bank in Nederland failliet gegaan. Dat bracht meteen wel een aantal problemen aan het licht op het terrein van het prudentieel toezicht"
"nl.proc.ob.d.h-tk-20092010-27-2444.1.13.1","nl.proc","speech",0.10271403,"2009-11-19","Jansen","SP","De heer","mp",6,"commons"," werkt – dat is helaas nog wel eens aan de orde – moeten wij dat verbeteren, maar wij moeten niet op voorhand zeggen dat het dan maar in een zbo moet of, erger nog, dat wij gaan privatiseren. Dan de <em>collectieve</em> geschillenbeslechting. Ik heb al gezegd dat ik een link zie met mijn amendement over de leges. Als er een goed, ruim systeem is van"
"nl.proc.ob.d.h-tk-20072008-2339-2348.1.10.5","nl.proc","speech",0.10271403,"2007-11-29","Hamer","PvdA","Mevrouw","mp",9,"commons"," willen kiezen. Dan iets over de <em>collectieve</em> waardeoverdracht. De PvdA vindt dat er een echte exitclausule moet worden opgenomen bij de <em>collectieve</em> waardeoverdracht. Er is sprake van een beperkte kostenberekening, maar een en ander kan binnen een beperkte termijn kan worden geregeld. Ook hierover overwegen wij een amendement in te dienen, samen met het"
"nl.proc.ob.d.h-tk-20112012-73-11.1.15.1","nl.proc","speech",0.10271403,"2012-04-05","Venrooy-van Ark","VVD","Mevrouw","mp",4,"commons"," is het persoonsgebonden budget voor individuele voorzieningen Kamerbreed in de wet geamendeerd. Met vooruitziende blik zijn de <em>collectieve</em> voorzieningen buiten die wettelijke verankering van het persoonsgebonden budget in de Wmo gehouden. Laat helder zijn dat met het compensatiebeginsel de Wmo fundamenteel verschilt van de AWBZ. Door te kunnen"
"nl.proc.ob.d.h-tk-20122013-61-9.1.9.1","nl.proc","speech",0.10271403,"2013-03-13","Bontes","PVV","De heer","mp",4,"commons","Voorzitter. Vandaag bespreken wij het wetsvoorstel tot wijziging van de Wet <em>collectieve</em> afwikkeling massaschade die ik gemakshalve zal afkorten tot WCAM. Dan weet iedereen wat wij bedoelen. Nederland wordt ook wel het claimparadijs genoemd. Zo zal Nederland mogelijk het centrum worden van wereldwijde claims tegen Philips, omdat consumenten te veel"
"nl.proc.ob.d.h-tk-20102011-19-29.1.8.1","nl.proc","speech",0.10271403,"2010-11-09","Mulder","VVD","De heer","mp",8,"commons"," solidariteit alleen kan worden gehandhaafd als je steeds naar alle <em>collectieve</em> regelingen kijkt. Welke mensen hebben er recht op? Wat kun je van mensen zelf vragen? Wat zijn hun plichten? Hoe kun je eigen bijdragen vragen, zodat mensen zelf een verantwoordelijkheid voelen voor een <em>collectieve</em> regeling? Als je de solidariteit wilt behouden, moet je steeds stelsels aanpassen. Dan hou je draagvlak. Dat is des te dringender als de kosten van de gezondheidszorg stijgen. Stijgende premies bedreigen de solidariteit."
"nl.proc.ob.d.h-tk-20092010-34-3315.1.7.1","nl.proc","speech",0.10271403,"2009-12-08","Spies","CDA","Mevrouw","mp",5,"commons"," lastenverzwaring. Hoe zorgen we ervoor dat we niet in hokjes blijven denken? Hoe verbinden we bijvoorbeeld de Wajong-problematiek met de AWBZ en het speciaal onderwijs? Waar kunnen we het profijtbeginsel meer gaan toepassen? Hoe maken we de overheid tot een andere, kleinere en effectievere overheid? Hoe komen we tot een kwaliteitsverbetering in de <em>collectieve</em>"
"nl.proc.ob.d.h-tk-20082009-6918-6940.1.5.34","nl.proc","speech",0.10271403,"2009-05-28","Van Geel","CDA","De heer","mp",6,"commons"," huishouding en de economie. Na zoveel maanden lijkt het gewoon te zijn wat dit kabinet gedaan heeft. Maar dat is het allerminst. Ik noem twee elementen om dit nog eens te onderstrepen. Tot 1980 zijn de <em>collectieve</em> uitgaven in ons land waanzinnig gestegen, tot meer dan 50% van wat we met elkaar verdienen. Het heeft 25 jaar aan herstelbeleid gekost om"
"nl.proc.ob.d.h-tk-20072008-7564-7583.1.11.1","nl.proc","speech",0.10271403,"2008-07-03","Wolbert","PvdA","Mevrouw","mp",31,"commons"," bij veel mensen die afhankelijk zijn van zorg en begeleiding; constaterende dat een deel van deze zorg en begeleiding onder de <em>collectieve</em> verantwoordelijkheid moet blijven vallen en het voor deze cliënten van belang is om zo spoedig mogelijk helderheid te hebben over waar zij hun zorg kunnen krijgen; overwegende dat een oplossing van deze"
"nl.proc.ob.d.h-tk-20122013-103-15.1.8.5","nl.proc","speech",0.10271403,"2013-07-03","Koolmees","D66","De heer","mp",5,"commons"," door andere overheden. Al in 2010 concludeerde het kabinet dat het voor de <em>collectieve</em> sector in zijn totaliteit voordelig kan zijn. Wat is inhoudelijk, dus los van de positie van de sectorbanken, de visie van de minister op lenen bij de schatkist door decentrale overheden? Is hij het eens met de decentrale overheden dat de positie van de"
"nl.proc.ob.d.h-tk-20122013-75-41.1.17.1","nl.proc","speech",0.10271403,"2013-04-16","Schouten","ChristenUnie","Mevrouw","mp",5,"commons"," opnemen. Als hij aangeeft dat hij die zaken in de ministeriële regeling zal opnemen, overweeg ik om mijn amendement in te trekken. Ik wil daar echter iets meer duidelijkheid over van de minister. Bij het amendement op stuk nr. 13 gaat het uiteraard over het aandeel in de <em>collectieve</em> uitgaven, niet om het EMU-saldo. De heer Koolmees wees mij daar al op"
"nl.proc.ob.d.h-tk-20152016-8-7.1.9.1","nl.proc","speech",0.10271403,"2015-09-30","Van Klaveren","Groep Bontes/Van Klaveren","De heer","mp",7,"commons"," dit kabinet zich laat leiden door de geest van de sociaaldemocratie: nivelleren, succes bestraffen, op de pof leven en <em>collectieve</em> regelingen gebruiken. Dit is linkse politiek in een notendop, en dat onder leiding van de VVD.  De overheidsuitgaven zijn te hoog en nemen nog steeds toe. Neem bijvoorbeeld de zorg, waar wij inmiddels 44,6 miljard aan"
"nl.proc.ob.d.h-tk-20142015-13-24.1.6.1","nl.proc","speech",0.10271403,"2014-10-14","Van Veen","VVD","De heer","mp",6,"commons"," hadden gedacht. De opdracht aan ons was simpel: de economie weer aan de praat krijgen, de koek weer groter maken en ervoor zorgen dat er weer meer banen komen, zodat we ook in de toekomst onze <em>collectieve</em> voorzieningen kunnen betalen.  Nu, twee jaar later, staat Nederland er beter voor. We vinden makkelijker werk, we durven weer een huis te kopen, we"
"nl.proc.ob.d.h-tk-20132014-32-11.1.10.5","nl.proc","speech",0.1016817,"2013-12-04","Karabulut","SP","Mevrouw","mp",11,"commons"," staatssecretaris met een fooi van 100 miljoen. Natuurlijk ben ik blij met 100 miljoen. Veel effectiever is echter om het geld niet daar weg te halen waar dat niet kan. Het ergste is nog wel dat de staatssecretaris vervolgens meegaat in het VVD-beleid. Dat ziet er als volgt uit: we schaffen alle <em>collectieve</em> voorzieningen af, je vraagt het maar"
"nl.proc.ob.d.h-tk-20102011-58-5.1.7.14","nl.proc","speech",0.1016817,"2011-03-09","Bontes","PVV","De heer","mp",3,"commons"," de levensverwachting aan de pensioenleeftijd of betreft dat <em>collectieve</em> arbeidsovereenkomsten of wat dan ook. Er mag geen politieke unie ontstaan, geen Europese superstaat. Ik zie dat als een historisch moment. Ik houd een keihard pleidooi dat dit nooit en te nimmer mag gebeuren. Geen enkele bevoegdheid mag overdragen worden. Nu niet, nooit niet"
"nl.proc.ob.d.h-tk-20072008-3328-3383.1.13.19","nl.proc","speech",0.1016817,"2008-01-23","Kant","SP","Mevrouw","mp",3,"commons"," dat de beste aanpak bestaat uit het bestrijden van sociaaleconomische verschillen. Mijn partijgenoot Luijben heeft daar al de nodige aandacht voor gevraagd. Er moet ook meer aandacht worden besteed aan de omstandigheden waarin ouderen wonen en leven en aan de gevolgen van die omstandigheden voor hun gezondheid. Ook op dat punt zou een consultatiebureau een belangrijke rol kunnen spelen. Daarom is aanbeveling 15 van de ouderencommissie om ouderen als doelgroep op te nemen in de Wet <em>collectieve</em> preventie, een heel goed idee."
"nl.proc.ob.d.h-tk-20052006-3927-3952.1.13.5","nl.proc","speech",0.1016817,"2006-03-22","Herben","LPF","De heer","mp",3,"commons"," godsdienst is het individuele recht van de burger, een godsdienst te kiezen of te verlaten. Er is op grond van de jurisprudentie geen reden om aan te nemen dat de rechter <em>collectieve</em> rechten aan een godsdienst of een groep volgelingen zal toekennen die voorrang hebben op de individuele grondrechten van de burger. Kan de minister voor Bestuurlijke"
"nl.proc.ob.d.h-tk-20092010-27-2444.1.12.1","nl.proc","speech",0.1016817,"2009-11-19","Depla","PvdA","De heer","mp",3,"commons","Voorzitter. Ik dank de minister voor de uitgebreide beantwoording. Wij hebben de wet met de amendementen en de reactie van de minister daarop beter kunnen maken op het punt van de <em>collectieve</em> geschillenbeslechting en de zittingsduur. Dank daarvoor. Ik heb nog twee puntjes openstaan. Ik ben blij dat minister de toezegging heeft gedaan dat hij zal"
"nl.proc.ob.d.h-tk-20072008-7805-7825.1.9.4","nl.proc","speech",0.1016817,"2008-09-03","Aptroot","VVD","De heer","mp",2,"commons"," zou de minister dan verantwoordelijk worden, waardoor wij de democratische controle kunnen uitoefenen. Over zaken als <em>collectieve</em> belangenbehartiging en reclame kunnen ondernemers ten slotte zelf wel een beslissing nemen. De heffing van 120 mln. per jaar kan dus komen te vervallen."
"nl.proc.ob.d.h-tk-20102011-29-47.1.20.28","nl.proc","speech",0.1016817,"2010-12-01","Van Klaveren","PVV","De heer","mp",4,"commons"," noemt de PVV islamisering, zoals ik net al stelde. De door het vorige kabinet gehanteerde definitie heb ik reeds genoemd. Ik beëindig mijn eerste termijn met de volgende vragen aan de minister: onderschrijft de minister de definitie van islamisering van het vorige kabinet? Ziet hij de toegenomen invloed van de islam op de <em>collectieve</em> sector?"
"nl.proc.ob.d.h-tk-20092010-49-4640.1.11.1","nl.proc","speech",0.1016817,"2010-02-02","Vermeij","PvdA","Mevrouw","mp",3,"commons"," over de afspraken die in arbeidsovereenkomsten staan op basis van individuele dan wel <em>collectieve</em> afspraken in cao's en sociale akkoorden. Daar kwam men deze zomer uit met de regering en nu staan wij hier. De PvdA hechtte toen, hecht nu en in de nabije toekomst aan sociale partners en aan akkoorden die met het kabinet worden gesloten over"
"nl.proc.ob.d.h-tk-20122013-17-8.1.6.1","nl.proc","speech",0.1016817,"2012-10-31","Voordewind","ChristenUnie","De heer","mp",3,"commons","Voorzitter. Vandaag bespreken we de budgettaire korting die voortvloeit uit het begrotingsakkoord. In dat akkoord is afgesproken dat de loonindicatie in <em>collectieve</em> sectoren op de nullijn wordt gezet. De zorgsectoren, die worden gefinancierd door middel van premies, zien hiervan uitgezonderd. Hiervoor zijn ook extra middelen gereserveerd. De"
