"id","index","type","score","date","speaker","party","function","role","paragraphs_count","house","highlight text"
"nl.proc.ob.d.h-tk-20082009-4392-4410.1.4.1","nl.proc","speech",0.21703191,"2009-02-12","Gerkens","SP","Mevrouw","mp",10,"commons"," doen. Zij moeten vaak tienduizenden plaatjes bekijken en beoordelen, terwijl de gemiddelde mens daarover niet eens wil praten. Zij kunnen op familiebijeenkomsten geen mooie verhalen over hun werk vertellen. Hun werk is immers altijd verdrietig, ook als de <em>daders</em> worden opgepakt. Zij kennen de slachtoffers namelijk niet alleen doordat er aangifte is"
"nl.proc.ob.d.h-tk-20102011-26-7.1.6.1","nl.proc","speech",0.21703191,"2010-11-24","Marcouch","PvdA","De heer","mp",9,"commons"," niet langer loont door de pakkans te vergroten, de straffen te verzwaren en de schade te verhalen op de <em>daders</em>. Dus ook de Partij van de Arbeid wil dat criminelen zo lang mogelijk verdwijnen uit de wijken die zij teisteren. De Partij van de Arbeid wil dus ook opsporen en handhaven. Daarom reik ik minister Opstelten en staatssecretaris Teeven hier"
"nl.proc.ob.d.h-tk-20102011-26-7.1.10.1","nl.proc","speech",0.21703191,"2010-11-24","Gesthuizen","SP","Mevrouw","mp",9,"commons"," minister van Justitie een groot meningsverschil gehad over de vraag of er geschikt mag worden in grote fraudezaken. Terwijl de samenleving voor miljoenen euro's wordt beduveld, komen de <em>daders</em> met een schikking weg. Denk aan de Klimop-vastgoedfraude en de Multi-vastgoedfraude. Dit speelt echter ook bij belastingfraude. Ik vind dat dat niet kan. Het OM"
"nl.proc.ob.d.h-tk-20102011-65-4.1.7.1","nl.proc","speech",0.21703191,"2011-03-24","Van Toorenburg","CDA","Mevrouw","mp",11,"commons"," onlangs in werking getreden en wij moeten daar natuurlijk uiteindelijk de effecten van kunnen zien. Het huidige regeerakkoord geeft aan dat slachtoffers een sterkere positie en nog meer ondersteuning moeten krijgen en dat <em>daders</em> harder worden aangepakt. Wij zijn het daarmee hartgrondig eens. De vraag is wanneer de Kamer de verdere uitwerking van die"
"nl.proc.ob.d.h-tk-20082009-2446-2460.1.7.1","nl.proc","speech",0.21703191,"2008-11-25","De Wit","SP","De heer","mp",10,"commons","Voorzitter. De samenleving moet erop kunnen vertrouwen dat wanneer een straf wordt opgelegd, die ook wordt ondergaan door degene die is veroordeeld. Het vertrouwen in de rechtsstaat komt in het geding als blijkt dat <em>daders</em> hun straf ontlopen. Dat de urgentie hiervan bij de organisaties en medewerkers die betrokken zijn bij de strafrechtstoepassing"
"nl.proc.ob.d.h-tk-20112012-17-28.1.15.1","nl.proc","speech",0.21703191,"2011-11-01","Van Toorenburg","CDA","Mevrouw","mp",7,"commons","En dan heb ik nog een voorbeeld: de slachtoffer-daderbemiddeling. Zou het niet veel beter zijn als de jeugdige <em>daders</em> zich bij deze gesprekken zouden moeten laten vergezellen door hun ouders? Die kunnen zien hoe hun kind reageert. Het is maar een voorbeeld. De CDA-fractie roept de bewindslieden op de ouders van kinderen die met de politie in"
"nl.proc.ob.d.h-tk-20142015-2-5.1.5.168","nl.proc","speech",0.21703191,"2014-09-17","Zijlstra","VVD","De heer","mp",8,"commons"," verscheurd door verdriet maar verenigd in vastberadenheid. Om de slachtoffers naar huis te brengen, om de <em>daders</em> te vervolgen. Om schouder aan schouder te staan met de nabestaanden. We zagen hoe sterk we kunnen zijn. We zagen waartoe we in staat zijn als 17 miljoen Nederlanders de handen ineenslaan. Ik weiger te geloven dat zo'n land het beste achter zich heeft. Ik geloof dat het beste nog moet komen. Als er één land is dat de toekomst met vertrouwen tegemoet kan zien, dan is dat Nederland."
"nl.proc.ob.d.h-tk-20152016-34-23.1.11.1","nl.proc","speech",0.21703191,"2015-12-08","Van Oosten","VVD","De heer","mp",8,"commons"," met dit wetsvoorstel organiseren dat slachtoffers erop kunnen vertrouwen dat <em>daders</em> ten spoedigste na hun veroordeling ook daadwerkelijk worden opgesloten achter slot en grendel, dan wel met een taakstraf aan de slag gaan? Welke bijdrage levert dit wetsvoorstel — collega's vroegen er al naar — aan het verminderen van het aantal loslopende en"
"nl.proc.ob.d.h-tk-20142015-80-14.1.9.1","nl.proc","speech",0.21703191,"2015-04-23","Ten Broeke","VVD","De heer","mp",9,"commons"," de toedracht kan worden gedaan, al dan niet op de rampplek, maar dan toch in elk geval op de militaire basis in Gilze-Rijen. Dat hebben wij zelf mogen constateren. 3. Dat de opsporing en de berechting van de <em>daders</em> linksom of rechtsom ter hand genomen wordt.  Het lijkt erop dat de missie van de afgelopen dagen nieuw DNA en ook veel persoonlijke"
"nl.proc.ob.d.h-tk-20142015-65-9.1.7.1","nl.proc","speech",0.21703191,"2015-03-19","Voordewind","ChristenUnie","De heer","mp",19,"commons"," de inspectie zal gaan toetsen. Ik hoor graag de reactie van de staatssecretaris op dat amendement.  Ik kom tot slot te spreken over de ernstige incidenten die een aantal maanden geleden hebben plaatsgevonden op de vo-scholen in Amsterdam. Er was sprake van afpersing, bedreiging en mishandeling van medeleerlingen. De <em>daders</em> werden tijdelijk"
"nl.proc.ob.d.h-tk-20142015-71-13.1.10.1","nl.proc","speech",0.21703191,"2015-04-02","Omtzigt","CDA","De heer","mp",10,"commons"," immers met lege handen indien Rusland dat doet en de <em>daders</em> uit zouden Rusland komen. Heeft de OVSE voldoende toegang en hoe beoordelen de regering en de minister-president de eigen inspanningen van de afgelopen maanden op dat vlak?  Ik wil kort de tax rulings benoemen. Het is van groot belang dat de afstemming tussen Nederland en Brussel accuraat is"
"nl.proc.ob.d.h-tk-20092010-61-5401.1.7.8","nl.proc","speech",0.21480589,"2010-03-10","Arib","PvdA","Mevrouw","mp",1,"commons","Het gaat juist om die bescherming van slachtoffers. U stelt eigenlijk voor om die slachtoffers niet te beschermen. Aan de ene kant zegt u dat de <em>daders</em> moeten worden aangepakt; de PVV heeft daar een eigen opvatting over. Voor een deel steun ik u ook in de harde aanpak van de <em>daders</em>, maar u vindt de vrouwenopvang eigenlijk overbodig en u vindt de"
"nl.proc.ob.d.h-tk-20112012-3-4.1.5.24","nl.proc","speech",0.21046594,"2011-09-22","Wilders","PVV","De heer","mp",1,"commons","Dat is mooi. Ik heb ook gevraagd naar de inzet van die teams bij straatterreur. Mijn tweede vraag is de volgende. De premier sprak zo-even heel wijze woorden over veiligheid en wat het kabinet daarmee gaat doen. Maar het probleem van straatterreur is nog onvoldoende opgelost. Helaas betreft het vaak Marokkaanse <em>daders</em>, <em>daders</em> van Marokkaanse"
"nl.proc.ob.d.h-tk-20122013-28-3.1.13.2","nl.proc","speech",0.21046594,"2012-11-28","Van der Steur","VVD","De heer","mp",1,"commons","Voorzitter. Een aantal zinnen van de heer De Wit gingen over de bijdrage van <em>daders</em> in de kosten van het strafproces. Hij had een vraag over de uitvoering. Ik wil de heer De Wit graag vragen wat hij daar principieel van vindt. Vindt hij ook niet, met de VVD-fractie, dat het volstrekt logisch is om van <em>daders</em> een bijdrage te vragen in de kosten die"
"nl.proc.ob.d.h-tk-20102011-42-5.1.10.9","nl.proc","speech",0.21046594,"2011-01-20","Marcouch","PvdA","De heer","mp",1,"commons","U zit in de regering, en ik constateer dat u deze helden enigszins in de steek laat. U waardeert en erkent hun belang niet, door bijvoorbeeld te bezuinigen op extra agenten. Uiteindelijk is veiligheid echt mensenwerk. Ik ben zelf politieman geweest: je moet de <em>daders</em> horen, je moet getuigen horen en er moet een deugdelijk onderzoek worden"
"nl.proc.ob.d.h-tk-20122013-29-14.1.48.4","nl.proc","speech",0.21046594,"2012-11-29","Van der Steur","VVD","De heer","mp",1,"commons","Ik heb net de concept-Handelingen van gisteren nagelezen. Het is opvallend dat mevrouw Van Tongeren gisteren in het hele debat, ook in onze uitwisseling over dit onderwerp, alleen maar over <em>daders</em> en dus veroordeelde criminelen sprak. Zij sprak er haar zorgen over uit dat er misschien onschuldige mensen tussen al die veroordeelde criminelen zitten"
"nl.proc.ob.d.h-tk-20092010-61-5401.1.19.1","nl.proc","speech",0.21046594,"2010-03-10","De Pater-van der Meer","CDA","Mevrouw","mp",1,"commons"," eerste termijn heb gezegd. Daaruit kun je conclusies trekken over wat effectief bijdraagt aan preventie. Wij geven de voorkeur aan preventie boven een harde aanpak van de <em>daders</em>; die komt pas daarna, als <em>daders</em> hardleers blijken. Slachtoffers vallen niet als een dader kan worden weerhouden van zijn daad."
"nl.proc.ob.d.h-tk-20142015-80-14.1.13.7","nl.proc","speech",0.21046594,"2015-04-23","Sjoerdsma","D66","De heer","mp",1,"commons","In het filmpje van het Openbaar Ministerie worden wel degelijk zeer sterke aanwijzingen geuit dat het waarschijnlijk <em>daders</em> zijn met een Russische nationaliteit. Deze <em>daders</em> zijn de grens van Rusland inmiddels overgegaan. Het kabinet heeft geen garantie dat door Rusland wordt meegewerkt. Ik vraag dat omdat eerdere afspraken met Rusland ook niet"
"nl.proc.ob.d.h-tk-20102011-61-8.1.8.14","nl.proc","speech",0.19842918,"2011-03-16","Recourt","PvdA","De heer","mp",1,"commons","Ik kan mevrouw Helder niet volgen. In het onderzoek dat ik ken, is gekeken naar vergelijkbare delicten. Bij het ene delict hebben <em>daders</em> een taakstraf gekregen, bij het andere delict een korte gevangenisstraf en er is gekeken wie daarna vaker in de fout ging. Nu, degenen met een gevangenisstraf gingen twee keer zo vaak in de fout. Waarom is dat niet te vergelijken?"
"nl.proc.ob.d.h-tk-20082009-4954-4981.1.11.14","nl.proc","speech",0.19842918,"2009-03-11","Griffith","VVD","Mevrouw","mp",1,"commons","Wij spreken in dit debat over vormen van ernstige overlast. Politie en burgemeesters geven aan dat zij de instrumenten ontberen om hiertegen effectief op te treden. Ik begrijp dat het antwoord van GroenLinks eruit bestaat dat in een vroeg stadium een dialoog op gang wordt gebracht tussen <em>daders</em> en slachtoffers."
"nl.proc.ob.d.h-tk-20112012-74-2.1.6.6","nl.proc","speech",0.19842918,"2012-04-10","Van der Staaij","SGP","De heer","mp",1,"commons","De minister zei al dat het gaat om het herkennen, het volgen wat er gebeurt en het investeren in preventie en repressie. Het gaat om een daadwerkelijke bestraffing ervan. Wat staat op stapel? Is er voldoende capaciteit om de pakkans te vergroten? Zo kan er afschrikwekkend worden opgetreden tegen <em>daders</em>."
"nl.proc.ob.d.h-tk-20122013-75-39.1.4.7","nl.proc","speech",0.19842918,"2013-04-16","Bontes","PVV","De heer","mp",1,"commons","In ons verkiezingsprogramma staat alles over meer politie op straat, effectief blauw en het zwaarder straffen van <em>daders</em>. Er staat heel veel in over law-and-order. Uiteraard valt de pakkans daar ook onder. We noemen ook nog de ondersteuning van hondenbrigades; kortom alles wat ik hier zojuist vertelde, staat ook in het verkiezingsprogramma. Ik herken de vraag dus niet."
"nl.proc.ob.d.h-tk-20082009-2337-2368.1.7.116","nl.proc","speech",0.19842918,"2008-11-20","Brinkman","PVV","De heer","mp",1,"commons","Ik kom terug op die vijfhonderd forensische experts. Zij zullen <em>daders</em> opsporen. Daar zullen zaken uit voort komen. Nu is het probleem dat tactisch rechercheurs die zaken moeten oplossen en dat zij die naar Justitie moeten leiden. Juist daar zit een groot pijnpunt. Er zijn namelijk duizenden vacatures bij die tactisch rechercheurs."
"nl.proc.ob.d.h-tk-20072008-3089-3098.1.6.3","nl.proc","speech",0.19842918,"2007-12-20","Bouwmeester","PvdA","Mevrouw","mp",1,"commons","Wij willen dat verkoop van alcohol aan jongeren onder de 16 jaar landelijk strafbaar wordt gesteld. De straf moet vooral een educatief karakter hebben. Het gaat er dus niet om om <em>daders</em> te betrappen en een boete te laten betalen. Het biedt de mogelijkheid om verplichte hulp te kunnen bieden."
"nl.proc.ob.d.h-tk-20072008-3974-3992.1.11.12","nl.proc","speech",0.19842918,"2008-02-26","Teeven","VVD","De heer","mp",1,"commons","Ik zal mijn vraag verduidelijken. Wat is het standpunt van de CDA-fractie over het onderzoek van de rijksrecherche? Moet dat een onderzoek zijn naar mogelijke strafbare feiten waarvan de <em>daders</em> niet bekend zijn of moet dat een fact-findingonderzoek zijn?"
"nl.proc.ob.d.h-tk-20082009-6738-6763.1.13.14","nl.proc","speech",0.19842918,"2009-05-20","Bouwmeester","PvdA","Mevrouw","mp",1,"commons","... want dat vinden wij namelijk ook heel erg. Dat gaat ons ook aan het hart, sterker nog, als je de medewerkers in zo'n winkel kent, komt het misschien nog wel tien keer harder aan. Ja, inderdaad, dat moeten wij zien te voorkomen, <em>daders</em> moeten worden berecht en voorkomen moet worden dat ze in recidive vervallen. Daarover zijn wij het eens."
"nl.proc.ob.d.h-tk-20062007-5340-5370.1.8.7","nl.proc","speech",0.19842918,"2007-09-12","Van Velzen","SP","Mevrouw","mp",1,"commons","Ik vind dit nog steeds een weinig overtuigend verhaal. Zolang het niet gaat om een dader, gaat het om een patiënt die een hulpverleningstraject in wordt gedwongen. Dat is waarschijnlijk terecht, maar je gaat toch niet kosten verhalen op een patiënt? Ik kan me voorstellen dat dit aan de orde is bij veroordeelde <em>daders</em>. Misschien doet u daar een voorstel toe."
"nl.proc.ob.d.h-tk-20092010-37-3665.1.10.2","nl.proc","speech",0.19842918,"2009-12-15","Azough","GroenLinks","Mevrouw","mp",1,"commons","In zijn brief van 8 oktober geeft de minister aan dat locatie- en gebiedsverboden inderdaad gehanteerd kunnen worden om te voorkomen dat bijvoorbeeld <em>daders</em> niet in contact kunnen komen met slachtoffers of überhaupt met kinderen. Stelt de heer Teeven dat ook voor? Ik zie niet goed wat hij bedoelt met het betrekken van de geschokte orde in de beoordeling."
"nl.proc.ob.d.h-tk-20112012-18-7.1.13.103","nl.proc","speech",0.19842918,"2011-11-02","Helder","PVV","Mevrouw","mp",1,"commons","De minister zei dat hij met politie en justitie de aanpak van het groepsgeweld gaat bespreken en dat hij meer <em>daders</em> daarvan bestraft wil zien. Dat is een mooie toezegging. Ik heb alleen niet gehoord of hij de Kamer daarover zal informeren."
"nl.proc.ob.d.h-tk-20112012-82-7.1.15.2","nl.proc","speech",0.19842918,"2012-04-26","Kooiman","SP","Mevrouw","mp",1,"commons","Voorzitter. Ik wil hier wel gesteld hebben dat ik gezegd heb dat inderdaad de islam nooit per definitie een oorzaak is van geweld. Ik vind wel dat de <em>daders</em> altijd aangepakt moeten worden, of ze nu de Bijbel lezen of de Koran."
"nl.proc.ob.d.h-tk-20092010-61-5401.1.7.7","nl.proc","speech",0.19842918,"2010-03-10","De Roon","PVV","De heer","mp",1,"commons","Ik wil dit moralistische gemekker helemaal niet horen in deze zaal. Ik ga over mijn eigen woorden en ik vind het belangrijk dat het roer nu om gaat. De <em>daders</em> moeten niet centraal staan, maar de slachtoffers en hun bescherming. Daar zou u zich zorgen over moeten maken, in plaats van wat u nu hebt gezegd."
"nl.proc.ob.d.h-tk-20092010-61-5401.1.7.9","nl.proc","speech",0.19842918,"2010-03-10","De Roon","PVV","De heer","mp",1,"commons","Ja, maar die riedel is wel de kern van de zaak: die <em>daders</em> moeten worden aangepakt op de manier die ik zojuist uiteen heb gezet. We moeten hen lang opsluiten en als ze een andere dan de Nederlandse nationaliteit hebben, moeten ze na hun straf het land worden uitgeknikkerd. Als ze een gebieds- en contactverbod krijgen opgelegd met een enkelband ..."
"nl.proc.ob.d.h-tk-20152016-30-16.1.11.69","nl.proc","speech",0.19842918,"2015-11-26","Fritsma","PVV","De heer","mp",1,"commons","Ik heb een vraag over veiligheid. De staatssecretaris heeft steeds gezegd dat het onwaarschijnlijk is dat terroristen meeliften met de vluchtelingenstroom. Hoe kijkt de staatssecretaris erop terug dat ten minste twee van de <em>daders</em> van de gruwelijke aanslagen in Parijs op die manier Europa zijn binnengekomen? Erkent de staatssecretaris dat hij de zaak heel erg heeft onderschat?"
"nl.proc.ob.d.h-tk-20152016-39-16.1.7.3","nl.proc","speech",0.19842918,"2015-12-17","Bergkamp","D66","Mevrouw","mp",1,"commons","Ik vind dat een terechte vraag van de PVV. Mijn vraag aan de bewindspersonen is ook hoe wij die paardenmishandelaar of -mishandelaren kunnen oppakken. Wat is daarvoor nodig? En helpt het als wij profielen van <em>daders</em> van huiselijk geweld en zedendelicten aan elkaar kunnen koppelen? Ik wacht op de reactie van de bewindspersonen."
"nl.proc.ob.d.h-tk-20142015-28-31.1.11.24","nl.proc","speech",0.19842918,"2014-11-25","Marcouch","PvdA","De heer","mp",1,"commons","Ja, dat sluit ik niet uit. Een van de verzoeken die ik doe, is om bijvoorbeeld de <em>daders</em> van discriminatie te confronteren met hun slachtoffer of degene die zij gediscrimineerd hebben. Dat zou heel goed een manier kunnen zijn die daarin past. Dat zou zomaar kunnen."
"nl.proc.ob.d.h-tk-20142015-28-31.1.11.25","nl.proc","speech",0.19842918,"2014-11-25","Helder","PVV","Mevrouw","mp",1,"commons","Dan merk ik toch licht tussen de heer Marcouch en de heer Recourt, want ik hoor de heer Marcouch nu zeggen dat de <em>daders</em> geconfronteerd moeten worden met de slachtoffers. Nou, daar zitten de slachtoffers niet op te wachten, en ik hoorde de heer Recourt zeggen dat het initiatief van het slachtoffer moet uitgaan."
"nl.proc.ob.d.h-tk-20122013-3-8.1.13.1","nl.proc","speech",0.18602735,"2012-09-20","Thieme","PvdD","Mevrouw","mp",12,"commons"," aangepakt moet worden. Niet doorschuiven, maar aanpakken, heren. \"Meeleven met slachtoffers, niet met <em>daders</em>\" kan een geweldig gemeenschappelijk uitgangspunt worden wanneer de VVD en de PvdA de bio-industrie definitief afschaffen. Dat kan het aantal slachtoffers met meer dan 500 miljoen per jaar terugbrengen. En niet alleen werkend Nederland verdient"
"nl.proc.ob.d.h-tk-20122013-28-3.1.5.1","nl.proc","speech",0.18602735,"2012-11-28","Helder","PVV","Mevrouw","mp",11,"commons"," kosten van een strafproces niet verhaald hoeven te worden op de <em>daders</em> en dat de rechter niet ieder feit apart naar behoren kon bestraffen als de dader meerdere misdrijven had gepleegd. Diverse keren heeft de PVV om deze maatregelen verzocht en nu staan ze in het regeerakkoord. Ik ben dus heel benieuwd of en, zo ja, hoe de bewindspersonen deze"
"nl.proc.ob.d.h-tk-20072008-5851-5875.1.7.1","nl.proc","speech",0.18602735,"2008-05-14","Schippers","VVD","Mevrouw","mp",16,"commons"," belang van de waarheid? Hoe krijgen wij het voor elkaar dat de overheid onverbloemd partij kiest voor de slachtoffers in plaats van de <em>daders</em> vrijuit te laten gaan? Aansluitend bij de constatering dat de inspectie zijn bezoeken aan bijvoorbeeld verpleeghuizen vooraf aankondigt, tenzij het verpleeghuis al onder verscherpt toezicht staat, vraagt de VVD"
"nl.proc.ob.d.h-tk-20102011-70-2.1.5.1","nl.proc","speech",0.18602735,"2011-04-06","Rouvoet","ChristenUnie","De heer","mp",11,"commons",", waarmee <em>daders</em> kunnen worden opgespoord, vervolgd en berecht. Daarnaast kan worden voorkomen dat onschuldigen worden verdacht of veroordeeld. Tegelijkertijd kent ook DNA-onderzoek zijn beperkingen als middel. Het is dan ook zaak een goed evenwicht te bewaren tussen het algemene belang van een veilige samenleving aan de ene kant en de bescherming"
"nl.proc.ob.d.h-tk-20152016-29-6.1.13.1","nl.proc","speech",0.18602735,"2015-11-25","Van der Staaij","SGP","De heer","mp",14,"commons"," tijdens detentie te investeren in een arbeidstraject. Welke mogelijkheden zijn er om dit soort trajecten ook financieel te steunen, al dan niet ook vanuit potten van Sociale Zaken? <em>Daders</em> moeten meer oog krijgen voor de gevolgen van hun handelen voor de slachtoffers en de samenleving. Hiervoor lopen zogenoemde SOS-projecten. Wat doen bewindslieden om"
"nl.proc.ob.d.h-tk-20142015-25-23.1.7.1","nl.proc","speech",0.18602735,"2014-11-18","Knops","CDA","De heer","mp",15,"commons"," landen met islamitisch fundamentalisme, alsmede in landen met autoritaire regimes. Onze fractie blijft pleiten voor VN-onderzoek naar de vervolging van christenen in het Midden-Oosten. Het gaat niet alleen om barbaarse praktijken, maar ook om de ideologie van de <em>daders</em>.  Nederland is verkozen als lid van de VN-Mensenrechtenraad. Op zichzelf is dat"
"nl.proc.ob.d.h-tk-20142015-25-23.1.10.1","nl.proc","speech",0.18602735,"2014-11-18","Sjoerdsma","D66","De heer","mp",15,"commons"," niet iets anders doen? Blijft het intensiveren, intensiveren en wachten op de Amerikanen? Dat er iets in Israël en Gaza moet gebeuren is evident. De vreselijke aanslag van vandaag onderstreept dat des te meer: vier doden. Omdat zij in een synagoge baden. Deze geweldsspiraal moet doorbroken worden. Deze <em>daders</em> moeten worden opgepakt en gestraft"
"nl.proc.ob.d.h-tk-20152016-34-23.1.8.1","nl.proc","speech",0.18602735,"2015-12-08","Helder","PVV","Mevrouw","mp",13,"commons"," opgelegd krijgen. \"Isd\" staat hierbij voor \"inrichting voor stelselmatige <em>daders</em>\". De voorbeelden die de minister geeft, doen mijn fractie niet van mening veranderen. Het niet willen verstoren van een zorg- of re-integratieproject is geen reden om boetes kwijt te schelden. Een persoon heeft te leren dat hij of zij niet bij elke tegenvaller in crimineel"
"nl.proc.ob.d.h-tk-20142015-91-9.1.5.1","nl.proc","speech",0.18602735,"2015-06-03","Rebel","PvdA","Mevrouw","mp",15,"commons"," actief op te treden op het gebied van preventie, slachtofferhulp en vervolging van <em>daders</em>. Een krachtige aanpak van geweld tegen vrouwen en huiselijk geweld is en blijft noodzakelijk. Om die reden moeten de lidstaten van de Raad van Europa elkaar aanspreken op het belang van spoedige ratificatie.  Het Verdrag van Istanboel is niet zomaar een"
"nl.proc.ob.d.h-tk-20112012-45-7.1.7.5","nl.proc","speech",0.17538828,"2012-01-25","Bouwmeester","PvdA","Mevrouw","mp",1,"commons","-maatregel voor stelselmatige <em>daders</em>, maar het gaat er juist om dat die stelselmatige <em>daders</em> er niet meer zijn. Wij moeten dus voorkomen dat er onveiligheid ontstaat. Dat is zorgen voor veiligheid. De zorg voor verwarde mensen is sociaal, veilig en ook nog eens goedkoop. Maar goed, blijkbaar kiezen de PVV en dit kabinet daar niet voor."
"nl.proc.ob.d.h-tk-20072008-5949-5963.1.11.2","nl.proc","speech",0.17538828,"2008-05-15","Gerkens","SP","Mevrouw","mp",1,"commons"," met symboolpolitiek, want in het grootste gedeelte van deze voorstellen gaat om het wetgeving over de aanpak, de vervolging en de opsporing van de <em>daders</em> en criminelen in Nederland. De websites waarover wij het hebben, zijn echter juist websites uit het buitenland. De <em>daders</em> en criminelen daarachter bevinden zich in het buitenland. De heer Brinkman"
"nl.proc.ob.d.h-tk-20102011-42-5.1.10.17","nl.proc","speech",0.17538828,"2011-01-20","Marcouch","PvdA","De heer","mp",1,"commons","Ik heb tot nu toe gezien dat rechters bij veroordelingen heel slim straffen. Daar ben ik blij mee; complimenten daarvoor. Tegen een aantal <em>daders</em> is reeds gezegd dat ze er de volgende keer niet bij zijn. Het gaat mij hier om een gemeentelijke bevoegdheid, waarover ik de mening van de staatssecretaris wil horen. Burgemeesters kunnen een"
"nl.proc.ob.d.h-tk-20102011-42-5.1.10.19","nl.proc","speech",0.17538828,"2011-01-20","Marcouch","PvdA","De heer","mp",1,"commons","Er zit een element van slim straffen in mijn voorstel. Daar hoort bij dat je tegen iemand kunt zeggen dat hij er de volgende keer niet bij is omdat hij met oud en nieuw geweld heeft gepleegd. Ik wijs erop dat deze <em>daders</em> over het algemeen bekende figuren zijn bij het lokaal bestuur. Ze plegen niet alleen met oud en nieuw geweld; ze doen het aldoor"
"nl.proc.ob.d.h-tk-20122013-71-17.1.4.19","nl.proc","speech",0.17538828,"2013-04-04","Van Klaveren","PVV","De heer","mp",1,"commons","Het is weer hetzelfde verhaal: ik krijg geen inhoudelijke reactie van D66. De oplossingen – ik vind het prachtig dat u de gelegenheid biedt om ze nog een keer te noemen – zijn volgens ons: minimumstraffen, huis- en wijkuitzettingen, het stopzetten of maximaal korten van uitkeringen van <em>daders</em>, standaard politie-inzet, honden, avondklokken, mobiele"
"nl.proc.ob.d.h-tk-20062007-5340-5370.1.11.3","nl.proc","speech",0.17538828,"2007-09-12","Azough","GroenLinks","Mevrouw","mp",1,"commons","De vraag waar wij het geld vandaan halen en of wij het niet van de <em>daders</em> kunnen plukken, is de kern geweest van het betoog van de heer Teeven. Dit probleem acht ik van groter belang dan de vraag waar wij het geld vandaan halen. Dat kan in bepaalde gevallen wellicht komen van de uithuisgeplaatste, de dader. Het gaat mij er echter vooral om dat het"
"nl.proc.ob.d.h-tk-20142015-65-9.1.13.8","nl.proc","speech",0.17538828,"2015-03-19","Beertema","PVV","De heer","mp",1,"commons"," mag het overal, maar niet bij heel ernstige zaken zoals moedwillig het leven kapotmaken van medeleerlingen? Dat terwijl de <em>daders</em> best te signaleren zijn. Ze zijn best te identificeren. Zo moeilijk is dat niet. Ik kon de <em>daders</em> heel vaak signaleren en identificeren. Waarom kunnen leraren dat nu dan niet meer? Wat is er aan de hand? Waarom wordt er niet gewoon een sanctie ingebouwd voor dit soort wangedrag?"
