"id","index","type","score","date","speaker","party","function","role","paragraphs_count","house","highlight text"
"nl.proc.ob.d.h-tk-20152016-2-7.1.10.1","nl.proc","speech",0.13145418,"2015-09-16","Thieme","PvdD","Mevrouw","mp",19,"commons"," <em>individu</em> zo weinig invloed op hebt. Zij verwachten dat vervuilers worden aangepakt, zoals bedrijven die gevaarlijk gif gebruiken in speelgoed, in snoepgoed en/of op akkers. Waarom, zo hoor ik om mij heen, doet de overheid dat niet? Hoe kan het dat als de overheid wordt veroordeeld door de rechter omdat zij te weinig tegen klimaatverandering doet"
"nl.proc.ob.d.h-tk-20052006-6307-6341.1.15.14","nl.proc","speech",0.12619603,"2006-09-06","Van der Sande","VVD","De heer","mp",1,"commons","Dat is natuurlijk geen reden om een motie in te dienen. Natuurlijk is het van belang om met beide benen in de samenleving te staan en te horen wat men wil, maar wij moeten beoordelen of datgene wat gevraagd wordt, reëel is. Volgens mij laat de nieuwe regeling het <em>individu</em> meer vrijheid. Hij kan namelijk kiezen voor voortzetting van de bestaande situatie en voor het werken op een andere manier. Dus de keuzevrijheid wordt groter. Ik vraag dus niet wat de redenen voor uw voorstel zijn. Die kende ik al."
"nl.proc.ob.d.h-tk-20052006-6307-6341.1.15.16","nl.proc","speech",0.12619603,"2006-09-06","Van der Sande","VVD","De heer","mp",1,"commons","Ik zal de vraag verduidelijken. Met de voorgestelde regeling kan het <em>individu</em> ontheffing krijgen en dus op dezelfde manier blijven werken. Hij kan echter ook opteren voor iets anders. Dat brengt de nieuwe situatie met zich mee. Er zijn dus voor hem twee mogelijkheden. Met de bestaande regeling heeft hij die niet. Daarmee kan hij niet kiezen voor iets nieuws. Dat kan hij nu wel en tegelijk ook kiezen voor de oude situatie. Hij heeft met deze regeling dus in ieder geval een optie meer."
"nl.proc.ob.d.h-tk-20102011-73-2.1.6.99","nl.proc","speech",0.12619603,"2011-04-13","Dijkgraaf","SGP","De heer","mp",1,"commons","Ik betreur dit, want we gaan terug naar de Middeleeuwen als we vanuit Den Haag gaan bepalen wat de inhoud van het geloof van mensen is. Mensen bepalen dat zelf. Een <em>individu</em> in Nederland kan dit als een enorme inperking van zijn godsdienstvrijheid ervaren. Dat is ook te merken aan de reacties die binnenkomen. Dat laat onverlet dat mevrouw Thieme"
"nl.proc.ob.d.h-tk-20062007-4034-4051.1.10.1","nl.proc","speech",0.12619603,"2007-06-05","Koşer Kaya","D66","Mevrouw","mp",1,"commons","Voorzitter. Het initiatief van de heer Luchtenveld ging uit van de kracht van het <em>individu</em>. Wanneer mensen willen scheiden en met elkaar afspraken willen maken, moeten zij dat ook kunnen doen. Daarvoor hebben zij geen rechter nodig, zeker als wij weten dat het in 90% van de gevallen goed gaat. Waarom moeten deze mensen regels opgelegd krijgen die zij niet nodig hebben? Ik zal daarom kort zijn. Of je een baan hebt of een partner, met dit kabinet kom je er nooit van af."
"nl.proc.ob.d.h-tk-20122013-92-12.1.6.10","nl.proc","speech",0.12619603,"2013-06-06","Marcouch","PvdA","De heer","mp",1,"commons","Ik begrijp heel goed dat je per <em>individu</em> moet bekijken wat goed is om te doen. Iemand moet bijvoorbeeld gemotiveerd zijn om te resocialiseren om die resocialisatie te laten slagen. Ik zou het te beperkt vinden als wij alleen aansturen op werk en niet breder kijken. Je moet per geval bekijken wat nodig is om te resocialiseren. Ik wil andere dingen"
"nl.proc.ob.d.h-tk-20112012-55-10.1.13.5","nl.proc","speech",0.12619603,"2012-02-16","Vermeij","PvdA","Mevrouw","mp",1,"commons","Op het moment dat je je baan verliest, zijn er wellicht werkgevers die jou kunnen helpen. Er worden verschillende visies over ontwikkeld en die staan ook in verschillende verkiezingsprogramma's. Maar hoe je ook tegen de samenleving aankijkt, of je vindt dat mensen dat echt allemaal zelf kunnen en moeten doen of dat ieder <em>individu</em>"
"nl.proc.ob.d.h-tk-20102011-67-4.1.4.59","nl.proc","speech",0.12619603,"2011-03-30","Van Raak","SP","De heer","mp",1,"commons","Volgens mij is de minister bang dat de rechter het werk van de Eerste en de Tweede Kamer gaat overdoen. Ik ben daar als volksvertegenwoordiger veel minder bang voor. Wij maken namelijk wetten in algemene zin. De rechter oordeelt op zijn beurt altijd naar aanleiding van een specifiek geval. Of een <em>individu</em> of een college zich tot de rechter wendt"
"nl.proc.ob.d.h-tk-20122013-88-4.1.6.12","nl.proc","speech",0.12619603,"2013-05-29","Bisschop","SGP","De heer","mp",1,"commons","Ik denk dat uit mijn hele betoog blijkt dat voor de SGP het huwelijk tussen een man en een vrouw normerend is. Voor de wet kan het gelijk zijn, maar dat betekent nog niet dat dit ook voor ieder <em>individu</em> en ieder geweten gelijk moet zijn. In dat opzicht is er inderdaad verschil in weging. Het gaat hierbij dus niet om de juridische lading. Ik ben"
"nl.proc.ob.d.h-tk-20102011-80-5.1.12.8","nl.proc","speech",0.12619603,"2011-04-28","De Roon","PVV","De heer","mp",1,"commons"," verzekerd is bij het opzoeken van dergelijke confrontaties, en dat je als <em>individu</em> geen beroep kunt doen op een ziektekostenverzekering of op bijstand door de Nederlandse consulaire dienst? Je hebt het immers zelf allemaal welbewust opgezocht!"
"nl.proc.ob.d.h-tk-20082009-521-525.1.10.4","nl.proc","speech",0.12619603,"2008-10-01","Van Gerven","SP","De heer","mp",1,"commons","Wat u zegt staat feitelijk in mijn motie. Bij twijfel geldt het principe \"ja, tenzij\". U zegt dat de afweging per <em>individu</em> moet worden gemaakt. Met de mensen die bijvoorbeeld in een verzorgingshuis worden opgenomen, moet eerst gesproken worden. Daarmee ben ik het helemaal eens, maar ik doelde op de situaties waarin onduidelijk is wat er medisch"
"nl.proc.ob.d.h-tk-20082009-3059-3104.1.5.10","nl.proc","speech",0.12619603,"2008-12-10","Pechtold","D66","De heer","mp",1,"commons"," programma vanuit een soort zelfbewustzijn en zelfbeschuldiging zegt dat wij als <em>individu</em> – dat zijn u en ik en iedereen – door ons graaien en ons meer, meer, meer en ons procentje ook medeverantwoordelijk zijn. Ik vond dat niet echt gepast. Ik vind het jammer dat u daar inmiddels niet anders op terugkijkt."
"nl.proc.ob.d.h-tk-20062007-2997-3020.1.8.8","nl.proc","speech",0.12619603,"2007-03-21","Pechtold","D66","De heer","mp",1,"commons","Ik redeneer vanuit het <em>individu</em>. Bij mondige ouders gaat het nu ook al goed, maar er zijn ook ouders die zo bekvechten dat het kind daar de dupe van wordt. Ik houd staande dat een ouderschapsplan niets zal veranderen aan de realiteit dat sommige ouders elkaar tegenwerken tot de laatste snik. Wij kennen allemaal de voorbeelden van ouders die elkaar op het absurde af naar het leven staan. De gedachte dat een ouderschapsplan iets oplost voor de kinderen van die ouders doet geen recht aan de realiteit."
"nl.proc.ob.d.h-tk-20052006-5012-5025.1.7.6","nl.proc","speech",0.12619603,"2006-05-23","Mosterd","CDA","De heer","mp",1,"commons","Ons uitgangspunt is dat er maatwerk moet worden geleverd. De uitkerende instantie moet dus nadrukkelijk per <em>individu</em> nagaan wat de situatie is. Stel dat iemand lang in de bijstand zit. Ik ben het er dan mee eens dat als cliënt en uitkeringsinstantie hun werk goed hebben gedaan maar zij toch niet tot een beter resultaat komen, de kans erg groot is"
"nl.proc.ob.d.h-tk-20112012-34-9.1.11.2","nl.proc","speech",0.12619603,"2011-12-08","Van Dam","PvdA","De heer","mp",1,"commons",". Leidt dit dan ook tot een strafblad? De mogelijkheid tot het beboeten van individuen loopt eigenlijk via het Wetboek van Strafrecht, maar krijgt een <em>individu</em> dat beboet wordt dan ook een strafblad?"
"nl.proc.ob.d.h-tk-20092010-71-6105.1.11.8","nl.proc","speech",0.12619603,"2010-04-01","Van Miltenburg","VVD","Mevrouw","mp",1,"commons","Ik blijf erbij dat dit in de communicatie echt onduidelijk is. De minister en ik denken bij \"handhaving\" misschien wel aan hetgeen de minister net heeft omschreven – de minister heeft dat volkomen juist gezegd – maar in de praktijk kan niet handhavend worden opgetreden als een <em>individu</em> een probleem heeft. In de brief schrijft u ook dat een"
"nl.proc.ob.d.h-tk-20102011-61-10.1.14.10","nl.proc","speech",0.12619603,"2011-03-16","Braakhuis","GroenLinks","De heer","mp",1,"commons","Ik vergelijk het een beetje met het BIG in de medische sector. Ik geloof niet dat elk <em>individu</em> dat in het register staat elke dag wordt gecontroleerd. Ook geloof ik niet dat er elke dag op handhaving wordt gestuurd. Maar als er structureel klachten zijn over een arts of over een verpleegkundige, kunnen daar consequenties aan vastzitten. Dat geldt"
"nl.proc.ob.d.h-tk-20092010-53-4861.1.13.47","nl.proc","speech",0.12619603,"2010-02-10","Spekman","PvdA","De heer","mp",1,"commons","Wij maken als overheid de organisatie soms eindeloos dik als we de kosten af kunnen schuiven naar de gebruiker. Bij dit systeem is dat feitelijk het gevaar. Ik wil daarvan af door meer richting te geven. Stel dat wij het redelijk vinden dat de leges 10% lager worden, wat betekent dat dan voor de organisatie, de kostendekkendheid en de risico's op misbruik en fraude? Dat is net een andere redeneerlijn dan u nu volgt, die ertoe leidt dat alle kosten worden opgeschoven op het <em>individu</em>."
"nl.proc.ob.d.h-tk-20112012-23-22.1.12.15","nl.proc","speech",0.12619603,"2011-11-15","Dibi","GroenLinks","De heer","mp",1,"commons","In het geval van Sahar heeft de SGP toch een soort van nieuwe regeling gesteund, waarmee het kabinet is gekomen omdat Afghaanse verwesterde meisjes onder een onevenredig zware psychosociale druk zouden komen te staan. Gaan we nu iedere keer op basis van een <em>individu</em> vechten voor nieuw beleid, of gaan we structurele oplossingen zoeken? Een van de"
"nl.proc.ob.d.h-tk-20092010-42-4131.1.10.7","nl.proc","speech",0.12619603,"2010-01-14","Van Velzen","SP","Mevrouw","mp",1,"commons","Ik wil die toetsing op voorhand. De heer Fritsma pleit ervoor om dit specifieke <em>individu</em>, dat een terreurdaad heeft gepleegd, te denaturaliseren. Hij wordt in de toekomst bediend, want deze wet maakt dat mogelijk. Wij praten hier langs elkaar heen. Volgens mij doet de heer Fritsma dat moedwillig en dat mag. Zoals de wet nu is geformuleerd, gaat de"
"nl.proc.ob.d.h-tk-20102011-32-8.1.8.96","nl.proc","speech",0.12619603,"2010-12-08","Azmani","VVD","De heer","mp",1,"commons","Nee, er is als het ware nog steeds een leer- en werkrecht. Het is nu wel veel meer gericht op werken en niet op uitkeringen die men kan krijgen. Er wordt gekeken naar een plan. Ik wil echt de verantwoordelijkheid bij het <em>individu</em> neerleggen, de persoon zelf. Die persoon heeft een plicht: je werkt of je studeert. Je kan aankloppen voor een stukje ondersteuning, maar je hebt in principe geen uitkering. Tot 27 jaar zit je namelijk op school of je bent aan het werk."
"nl.proc.ob.d.h-tk-20122013-91-6.1.6.34","nl.proc","speech",0.12619603,"2013-06-05","Bisschop","SGP","De heer","mp",1,"commons"," bescherming tegen een overmachtige overheid hebben wij ooit zelfs grondrechten uitgevonden; dat is de oorsprong van de grondrechten – en anderzijds het recht van het <em>individu</em>? Daar ligt namelijk de oplossing."
"nl.proc.ob.d.h-tk-20092010-36-3458.1.5.32","nl.proc","speech",0.12619603,"2009-12-10","Spekman","PvdA","De heer","mp",1,"commons","Ik heb twee vragen. Vindt de staatssecretaris het voorstelbaar dat wij ook in de toekomst als overheid nog meer investeren in een <em>individu</em> dan hij daadwerkelijk in economische zin oplevert? Dan doel ik niet op de WSW maar ook daarbuiten, waarbij gemeenten of de rijksoverheid die keus maken. De tweede vraag gaat over het minimumloon. Er was net een"
"nl.proc.ob.d.h-tk-20082009-4640-4655.1.4.5","nl.proc","speech",0.12619603,"2009-02-19","De Krom","VVD","De heer","mp",1,"commons","Nee, integendeel. Mijn keuze zou een heel andere zijn. De reden voor het aanvragen van dit spoeddebat is om te voorkomen dat er een veel ruimere uitleg aan wordt gegeven. Daarom is het ook van belang hoe de regering de uitspraak van het Hof uitlegt. Blijft de opvatting van de regering zoals zij nu is en gaat het om de schade die een <em>individu</em> kan"
"nl.proc.ob.d.h-tk-20112012-31-7.1.49.10","nl.proc","speech",0.12619603,"2011-12-01","Çelik","PvdA","De heer","mp",1,"commons"," instelling, een bedrijf, namens een <em>individu</em> aangifte kan doen, betwijfel ik. In mijn carrière bij de politie heb ik het nog nooit meegemaakt. Ik zou graag ook op dat punt een antwoord hebben."
"nl.proc.ob.d.h-tk-20052006-2701-2719.1.7.9","nl.proc","speech",0.12619603,"2006-01-25","Slob","ChristenUnie","De heer","mp",1,"commons","Met een drempel als door ons wordt voorgesteld, zullen kleinere organisaties of een individuele burger steun moeten zoeken voor hun initiatief om zo ver te komen. Een organisatie of een <em>individu</em> zal wel degelijk enige inspanning moet plegen, maar ik sluit niet uit dat hij dit aantal wel degelijk zal weten te behalen. Misschien zal niet iedereen"
"nl.proc.ob.d.h-tk-20122013-71-13.1.8.4","nl.proc","speech",0.12619603,"2013-04-04","Leijten","SP","Mevrouw","mp",1,"commons","Er zijn mensen die hun geld inleggen in een pensioenvoorziening of sparen voor een pensioenvoorziening, voor hun oude dag. Zij moeten dat opeten. Dat zijn zelfstandigen met een beperking, maar wel zelfstandig wonen. We weten allemaal dat het onbeschrijflijk duur is om je als <em>individu</em> aan te melden bij een pensioenverzekeraar. Zij sparen voor hun"
"nl.proc.ob.d.h-tk-20052006-3736-3744.1.5.8","nl.proc","speech",0.12619603,"2006-03-15","De Pater-van der Meer","CDA","Mevrouw","mp",1,"commons","Ik probeer het nog een keer. U zegt dat zo'n verklaring er niet behoort te komen. Die kán er ook niet komen, als het om een griepje gaat. Het gaat om een verklaring van een arts over een ziekteperiode van 16 weken, waarin men niet kan functioneren. Dat betreft behoorlijke ziektes. Ik herhaal dat het geen plicht is om een verzoek te doen om je te laten vervangen als je een griepje hebt, maar een recht. De <em>individu</em> mag zelf afwegen of hij of zij dat verzoek überhaupt doet."
"nl.proc.ob.d.h-tk-20102011-27-16.1.10.17","nl.proc","speech",0.12619603,"2010-11-25","Marcouch","PvdA","De heer","mp",1,"commons","Ik heb het u proberen uit te leggen. Het gaat om een toevoeging aan een maatregel die een minderjarige wordt opgelegd. Aan de ene kant kan die maatregel bestaan uit het uitzitten van een straf voor het gepleegde delict. Aan de andere kant, afhankelijk van het <em>individu</em>, kan die maatregel tevens bestaan uit het behalen van een startkwalificatie"
"nl.proc.ob.d.h-tk-20062007-2826-2873.1.5.16","nl.proc","speech",0.12619603,"2007-03-13","Azough","GroenLinks","Mevrouw","mp",1,"commons","Ik moet zeggen dat ik nog geen argumentatie inzake de effectiviteit van deze maatregelen heb gehoord in uw betoog tot nu toe. Kunt u nog eens toelichten waarom iemand die een beschikking thuis krijgt en dus weet dat hij in de gaten wordt gehouden, niet gewoon over gaat op een ander voorwerp of een ander <em>individu</em>? Ik snap eerlijk gezegd niet wat de"
"nl.proc.ob.d.h-tk-20082009-1183-1215.1.13.9","nl.proc","speech",0.12619603,"2008-10-29","Brinkman","PVV","De heer","mp",1,"commons"," zitten, heel goede kinderen kunnen zijn. Ik maak mij er eerlijk gezegd niet zo veel zorgen om. Wat voor mij van belang is, is de taak van de overheid daarin. Die moet minimaal zijn; het <em>individu</em> moet zo veel mogelijk tot zelfontplooiing kunnen komen."
"nl.proc.ob.d.h-tk-20112012-16-6.1.61.1","nl.proc","speech",0.12619603,"2011-10-27","Sterk","CDA","Mevrouw","mp",1,"commons","Ik zal het nog een keer zeggen. Het is uitermate bijzonder dat wij hier in de Kamer praten over een individueel geval. Op zichzelf is dat al iets heel bijzonders. Wij weten dat het <em>individu</em> onder grote spanning staat, omdat het gaat over zijn toekomst. Wij hebben daarover vandaag een debat. Wij vinden het van het grootste belang dat wij"
"nl.proc.ob.d.h-tk-20122013-29-14.1.6.116","nl.proc","speech",0.12619603,"2012-11-29","Gesthuizen","SP","Mevrouw","mp",1,"commons","Ik meen dat die onderzoeksplicht er in dit geval wel is. Ik heb daartoe ook een motie in voorbereiding. Ik begrijp natuurlijk ook de noodzaak om voorzichtig om te gaan met zaken die te herleiden zijn naar een <em>individu</em>, maar als de staatssecretaris hier zou kunnen toezeggen dat hij de Kamer desgewenst vertrouwelijk over de zaak wil informeren, dan kan ik me voorstellen dat ik de motie nog niet indien, of de motie indien en vervolgens aanhoud. Anders zie ik me genoodzaakt de motie wel in te dienen."
"nl.proc.ob.d.h-tk-20072008-4880-4921.1.7.2","nl.proc","speech",0.12619603,"2008-04-01","Pechtold","D66","De heer","mp",1,"commons"," niet zo dat de mens altijd zelf verantwoordelijk is voor het omgaan met denkbeelden, dat het <em>individu</em>, of het nu een christen, een islamiet of een libertijn is, altijd zelf verantwoordelijk is voor zijn handelen? Wat wil hij zeggen met dat voorbeeld van dat eerste interview?"
"nl.proc.ob.d.h-tk-20092010-22-1865.1.15.7","nl.proc","speech",0.12619603,"2009-11-10","Pechtold","D66","De heer","mp",1,"commons","Omdat dit iets is waarbij niet alleen de overheid centraal staat. Voor een leven lang leren zijn drie partners verantwoordelijk, de drie o's. Dit zijn de ondernemers, de overheid en het onderwijs. Je bent dadelijk wat ons betreft ook als <em>individu</em> verantwoordelijk, maar het is ook iets wat tussen maatschappelijke partners, tussen werkgevers en"
"nl.proc.ob.d.h-tk-20142015-57-8.1.13.3","nl.proc","speech",0.12619603,"2015-02-26","Van der Staaij","SGP","De heer","mp",1,"commons"," niet per se om dat dit <em>individu</em> of deze persoon ook betrokken is bij gevechtshandelingen tegen het Koninkrijk. Ik vind dat de parallel wel degelijk opgaat, gezien de manier waarop ISIS nu opereert en gezien het feit dat we nu juist daar, mede met steun vanuit Nederland, in gevechtshandelingen betrokken zijn."
"nl.proc.ob.d.h-tk-20152016-11-12.1.4.3","nl.proc","speech",0.12619603,"2015-10-07","Grashoff","GroenLinks","De heer","mp",1,"commons","Het lijkt net alsof u toch bepaalde accenten in mijn verhaal mist. Overigens heb ik mijn rijbewijs op mijn 21ste gehaald. Volgens mij ging het er bij dat rijbewijs erg om dat je uiteindelijk goed leerde rijden. Dat is de essentie. Toetsing heeft een functie voor het <em>individu</em> en dus niet voor het inrichten van een onderwijsbestel of het vergelijken"
"nl.proc.ob.d.h-tk-20142015-12-9.1.6.9","nl.proc","speech",0.12619603,"2014-10-09","Van Ojik","GroenLinks","De heer","mp",1,"commons"," kosten niet bij het <em>individu</em> komen. De heer Heerma wijst er terecht op dat de kosten met dit amendement bij de werkgever terechtkomen. Maar wellicht komen die in de toekomst voor een deel ook bij de overheid terecht."
"nl.proc.ob.d.h-tk-20142015-32-12.1.6.7","nl.proc","speech",0.12619603,"2014-12-03","Van Ojik","GroenLinks","De heer","mp",1,"commons","Het lijkt of ze daarmee een beroep doet op de burger en het <em>individu</em> om een verantwoorde keuze te maken. De vraag is wat de overheid moet doen of kan doen om het maken van die verantwoorde keuze — ik meen dat wij het over die keuze wel eens zijn — te bewerkstelligen. Burgers denken vaak: ik kan dat wel doen, maar de grote vervuilers gaan gewoon door. Ik zoek naar het instrumentarium dat volgens mevrouw Thieme gebruikt moet worden om de doelen, waarover wij het eens zijn, te realiseren."
"nl.proc.ob.d.h-tk-20142015-60-11.1.5.27","nl.proc","speech",0.12619603,"2015-03-05","Klaver","GroenLinks","De heer","mp",1,"commons",", wij volksvertegenwoordigers kijken of een wet globaal aan de Grondwet voldoet. Maar in individuele gevallen kan dat heel anders uitpakken. Waarom wil een echte liberaal als de heer Taverne — zo ken ik hem — het <em>individu</em> het recht ontzeggen om bij de rechter zijn grondwettelijke recht aan te vechten?"
"nl.proc.ob.d.h-tk-20152016-8-4.1.6.20","nl.proc","speech",0.12619603,"2015-09-30","Van Klaveren","Groep Bontes/Van Klaveren","De heer","mp",1,"commons"," gelachen om zijn inbreng. Mijn punt is dat het streven van de heer Harbers naar meer economische vrijheid van het <em>individu</em> totaal niet te rijmen is met deze verhogingen. Hoe rijmt de heer Harbers die verhogingen met het verhaal dat hij streeft naar lagere belastingen?"
"nl.proc.ob.d.h-tk-20082009-88-114.1.8.139","nl.proc","speech",0.11897875,"2008-09-18","Pechtold","D66","De heer","mp",1,"commons","De werkelijkheid van mensen bestaat niet alleen uit de CPB-cijfers voor deze groepen. Ik kijk natuurlijk ook naar die cijfers. Alleenstaande AOW'ers met een pensioen van € 10.000 staan op 0%. Er zijn nog andere dingen in het leven. Ik noem ontslag, ziekte en schuldsanering. Daar zijn mensen als <em>individu</em> van afhankelijk. Daar voelen de mensen wat"
"nl.proc.ob.d.h-tk-20112012-91-15.1.8.11","nl.proc","speech",0.11897875,"2012-06-05","Fritsma","PVV","De heer","mp",1,"commons"," niet beweren dat er niets verandert. Nu is de situatie, ik citeer: \"Er moet sprake zijn van unieke omstandigheden die specifiek op het <em>individu</em> betrekking hebben en die maken dat het weigeren van een verblijfsvergunning een onbedoelde hardheid tot gevolg heeft\". Ze hebben dus specifiek betrekking op het <em>individu</em>. Nu voorziet de minister in een"
"nl.proc.ob.d.h-tk-20142015-60-11.1.5.51","nl.proc","speech",0.11897875,"2015-03-05","Klein","Klein","De heer","mp",1,"commons","Dan ontgaat de heer Taverne de kern van het initiatiefwetsvoorstel. Dat is niet ingegeven vanwege een diskwalificatie van het functioneren van de Eerste of de Tweede Kamer. Het gaat er niet om dat wij niet goed toetsen. Het gaat over een stukje rechtsbescherming van het <em>individu</em>. Dat <em>individu</em> kan naar de rechter gaan en zeggen: goh, dit is voor"
"nl.proc.ob.d.h-tk-20072008-1935-1973.1.24.6","nl.proc","speech",0.10516335,"2007-11-21","Cramer","ChristenUnie","De heer","mp",1,"commons","U gebruikt heel grote woorden voor wat de ChristenUnie graag zou willen. Wij hebben nooit onder stoelen of banken gestoken dat wij het gedrag willen beïnvloeden om een gezondere leefstijl te bewerkstelligen. Wij weten dat de VVD dit allemaal op z'n beloop wil laten en dat zij de zorgkosten aan de marktwerking wil overlaten, zodat je als <em>individu</em>"
"nl.proc.ob.d.h-tk-20132014-5-4.1.3.38","nl.proc","speech",0.10516335,"2013-09-25","Zijlstra","VVD","De heer","mp",1,"commons","% koopkracht voor de hoogste inkomens, min 0,75% koopkracht voor de laagste inkomens en tussen 0 en min 0,25% voor de middeninkomens. Voor ieder <em>individu</em> pakt het verschillend uit. Op dat soort zaken sturen wij. Als wij in 2015 gekke afwijkingen zien ten opzichte van het afgesproken plaatje, zullen wij op dat moment corrigeren."
"nl.proc.ob.d.h-tk-20112012-63-8.1.16.19","nl.proc","speech",0.10516335,"2012-03-14","Brinkman","PVV","De heer","mp",1,"commons","Het gaat mij niet om de hoogte van het bedrag, het gaat mij puur om het principe. Ik ga niet lopen marchanderen over bedragen. Ik ga niet van € 4500 naar € 6500 of misschien naar € 10.000. Daar gaat het mij helemaal niet om. Het gaat mij puur om het principe. Het gaat mij om het feit dat er mensen zijn die als <em>individu</em> na verloop van tijd een"
"nl.proc.ob.d.h-tk-20122013-106-3.1.7.1","nl.proc","speech",0.10516335,"2013-09-04","Bergkamp","D66","Mevrouw","mp",19,"commons"," geven, als ik tenminste alle geluiden goed beluister die soms overigens wel wat tegenstrijdig zijn. Voor D66 als sociaal-liberale partij staat de vrijheid van het <em>individu</em> voorop. De mogelijkheid om de regie te hebben over je eigen leven staat voor ons centraal. Dat geldt naar onze mening ook voor mensen met een beperking. Pas als je je eigen"
"nl.proc.ob.d.h-tk-20052006-6307-6341.1.8.14","nl.proc","speech",0.10516335,"2006-09-06","Stuurman","PvdA","Mevrouw","mp",1,"commons"," als <em>individu</em> toestemming geven om op zondag te werken. Dat blijft zo. Zo stond het ook in de wet waar erg aan gehangen wordt en die onder anderen van mijn collega afkomstig is. Dat zie ik terug. Ik ben ook heel benieuwd naar de uitleg van de minister, maar ik lees het wetsvoorstel op dit punt anders dan de heer Van der Vlies."
"nl.proc.ob.d.h-tk-20122013-21-4.1.4.7","nl.proc","speech",0.10516335,"2012-11-13","Zijlstra","VVD","De heer","mp",1,"commons"," beheersbaar. Als je het laat lopen, als je het doorschuift, zal de rekening op een gegeven moment worden gepresenteerd. Voor ieder <em>individu</em> geldt dat als je iets op krediet koopt en je niet afbetaalt, op een gegeven moment de deurwaarder voor de deur staat. Dat geldt ook voor de overheid. Sommige Europese landen merken dat nu. Wij als VVD willen voorkomen dat Nederland ooit in die situatie terechtkomt."
"nl.proc.ob.d.h-tk-20082009-88-114.1.8.141","nl.proc","speech",0.10516335,"2008-09-18","Pechtold","D66","De heer","mp",1,"commons"," een maatschappelijke trend waarin alsmaar solidariteit van hen wordt gevraagd. Of wij over kinderopvang of over tal van andere zaken praten, overal ziet de alleenstaande dat er een beroep wordt gedaan op zijn solidariteit. Ik zou graag zien dat u naast het gezinsbeleid het komend jaar in kaart brengt of wij, dwars door al die groepen heen, ook wat meer aandacht kunnen krijgen voor dat <em>individu</em>. Ik zou het zeer waarderen als u daar met een paar maanden op terug wilt komen."
